name	subreddit	title	upvote_ratio	ups	downs	coding
t3_jyjbkq	politics	Brad Raffensperger: Georgia’s election results are sound	1.0	15	0	O
t3_jyjbdf	politics	Why counting presidential votes is not for federal district courts-The remaining litigation almost certainly will not have a practical effect on the election’s outcome for a variety of reasons	1.0	6	0	O
t3_jyj9lo	politics	Michigan sheriff's court deputy fired after posting photo of Kamala Harris watermelon carving	0.95	18	0	O
t3_jyis6n	politics	Kansas issued a face mask order. Counties that opted out saw COVID-19 cases rise 100% in 6 weeks, CDC says	0.97	146	0	O
t3_jyie1r	politics	Mike Kelly, Sean Parnell Request To Declare Mail-In Voting Unconstitutional In Pennsylvania, Deny Results From 2020 Election Mail-In Ballots – CBS Pittsburgh	0.91	90	0	O
t3_jyib9d	politics	Republican leaders ask Michigan election board to delay certification of results, in latest GOP effort to cast doubt on the vote	0.93	65	0	O
t3_jyi202	politics	The Presidential Transition Meets Murphy’s Law | by Walter M. Shaub Jr.	0.89	18	0	O
t3_jyhv3n	politics	Many GOP lawmakers shrug off statehouse mask-wearing rules	0.89	49	0	O
t3_jyhkkr	politics	12 million Americans could lose crucial unemployment benefits just after Christmas	0.96	64	0	O
t3_jyhhg0	politics	Texas State Board of Education makes changes to Sex-Ed classes, excluding LGBTQ youth	0.97	76	0	O
t3_jyhca2	politics	Powell: Servers were 'confiscated' from electronic voting company 'in Germany,' and 'it was our forces that got' them	0.08	0	0	O
t3_jyh85t	politics	CDC: Sturgis motorcycle rally blamed for coronavirus spread in Minnesota	0.99	975	0	O
t3_jyh348	politics	Fact checking misleading claims over the Georgia recount	0.87	44	0	O
t3_jyh180	politics	Reverend who led Halloween march to the polls in North Carolina charged with felony assault	0.89	95	0	O
t3_jyh01o	politics	Black women helped push Democrats to the finish line in Georgia. Here's how they can do it again	0.97	203	0	O
t3_jygxnx	politics	Nearly 200 legislators have tested positive for coronavirus nationwide and four have died as GOP flouts rules	0.98	354	0	O
t3_jygu45	politics	Susan Rice: 'This is most irresponsible leadership during a transition' ever seen	0.98	868	0	O
t3_jygsfc	politics	Top mayoral candidate admonishes new voting system amidst efforts to delay it	0.83	21	0	O
t3_jygrxg	politics	Powerful Ohio utilities regulator steps down following FBI search of his home	0.98	131	0	O
t3_jygn0t	politics	COVID-19 vaccines are almost ready to be distributed. Who gets them after health care workers? Here's a list.	0.95	57	0	O
t3_jygldo	politics	No, State Legislatures May Not Reverse the Result of the Election	0.95	448	0	O
t3_jygjcl	politics	South Dakota Gov. Kristi Noem Ignores CDC Advice On Thanksgiving Gatherings	0.93	121	0	O
t3_jygj9b	politics	Some New Mexico essential business close due to virus spike	0.9	27	0	O
t3_jygj51	politics	GOP seeks certification delay, state recommends approval	0.93	59	0	O
t3_jygimf	politics	The Republican Wing of the Democratic Party	0.43	0	0	O
t3_jygiga	politics	A bipartisan group of Georgia teens is trying to flip the Senate by enlisting thousands of students to vote in the January runoffs	0.99	2253	0	O
t3_jygfhr	politics	Stacey Abrams’ Group Dropping $2.7 Million Ahead of Georgia Senate Runoffs	0.15	0	0	O
t3_jygb0p	politics	The Latest: Midwest governors: Stay home for Thanksgiving	0.97	60	0	O
t3_jyg5up	politics	Tibetan political leader makes visit to White House for first time in six decades	0.29	0	0	O
t3_jyfrcz	politics	RNC chair urges Michigan board to pause certification of election results	0.78	81	0	O
t3_jyfjqa	politics	How Do You Govern When Half The Country Is Trapped In A Disinformation Bubble? | All In | MSNBC	0.97	686	0	O
t3_jyffh5	politics	Democrats' New Plan To Win Georgia's Crucial Senate Seats In A Pandemic Is To Actually Knock On Doors	0.97	590	0	O
t3_jyfau4	politics	When Coups Come Home	0.87	35	0	O
t3_jyfahb	politics	Republicans ask Michigan election board to delay certification for two weeks, audit Detroit votes	0.92	185	0	O
t3_jyf92j	politics	How Hispanic Voters Swung Miami Right — Many expected that liberal young Hispanic voters would propel a Democratic wave. But Miami, a city where Hispanics hold the levers of power, confounded expectations.	0.69	23	0	O
t3_jyf6mo	politics	Treasury Secretary Steven Mnuchin flubs and says the White House is 'working on a mass distribution of the virus'	0.96	925	0	O
t3_jyf5m1	politics	One In Three Americans Didn't Vote. Should We Force Them To Next Time?	0.85	143	0	O
t3_jyf5jy	politics	Hawaii officials are preparing to immunize 44,000 high-risk residents next month if COVID-19 treatment is approved	0.98	96	0	O
t3_jyf46l	politics	Abrams’ group funds grassroots efforts to win Georgia’s Senate runoffs	0.99	476	0	O
t3_jyf2be	politics	Georgia Senator David Perdue Privately Pushed for a Tax Break for Rich Sports Team Owners: It’s unclear why Senator Perdue was interested in tax regulation that would impact only a tiny set of the richest Americans.	0.99	1750	0	O
t3_jyew3o	politics	The Latinx Culture War is the Untold Story of the 2020 Election	0.3	0	0	O
t3_jyeder	politics	Many GOP Lawmakers Shrug off Statehouse Mask-Wearing Rules	0.89	60	0	O
t3_jyecdj	politics	State, national GOP seek to delay certification of election results	0.95	114	0	O
t3_jyebck	politics	White House largely silent on health precautions for Thanksgiving	0.89	62	0	O
t3_jyeayj	politics	Charles Koch: Partisan politics don’t work. It’s time for a new way	0.59	16	0	O
t3_jye1m4	politics	Many GOP lawmakers shrug off Statehouse mask-wearing rules	0.96	198	0	O
t3_jydy0o	politics	U.S. reduces length of sanctions waiver, increasing pressure on Iraq and Iran	0.82	18	0	O
t3_jydwzy	politics	CEO Over VOA Acted Unconstitutionally In Pursuing Bias Claims, U.S. Judge Rules	0.99	424	0	O
t3_jydrnk	politics	Lawyers for U.S. Homeland Security whistleblower get security clearances	0.99	593	0	O
t3_jydbpt	politics	Orlando Hall’s Execution Continues Administration’s Unprecedented Blood Lust at the Expense of Justice	0.85	72	0	O
t3_jyd9y8	politics	Wisconsin GOP election commissioner praised right-wing provocateur who promoted voter fraud conspiracies	0.94	139	0	O
t3_jyd9hi	politics	Outrage in Black community over claims of voter fraud in US election	0.97	408	0	O
t3_jyd3jv	politics	Shutdown deadline nears as White House, Congress tangle over VA funding	0.91	68	0	O
t3_jyczbo	politics	Saturday Morning Political Cartoon Thread	0.94	164	0	O
t3_jyd2yd	politics	Last challenge to Maricopa County election results tossed by judge	0.99	753	0	O
t3_jyd2lg	politics	Los Angeles County on the Brink of New Health Orders Amid Surge in Covid Cases	0.92	41	0	O
t3_jyd23u	politics	It’s time for California to end the racist and expensive war on drugs. Here’s how	0.92	76	0	O
t3_jycvv9	politics	Loren Culp, refusing to concede Washington gubernatorial race, turns on top Republicans	0.92	53	0	O
t3_jycv9b	politics	Andrew Cuomo to receive International Emmy for virus briefings	0.88	93	0	O
t3_jyctkg	politics	The US Could Soon Ban the Selling of Carrier-Locked Phones	0.99	567	0	O
t3_jyctfz	politics	Newsmax and OANN are telling lies about the election as more people tune in	0.98	4158	0	O
t3_jycsvh	politics	Georgia Gov. Brian Kemp certifies election results, calls for another hand recount	0.18	0	0	O
t3_jychxg	politics	Grassley misses Senate vote; first time in 27 years	0.98	935	0	O
t3_jychq7	politics	'It's a big, scary mess': 12 million Americans to lose jobless aid after Christmas if Congress fails to act	0.98	458	0	O
t3_jyc1cg	politics	Gov. Andrew Cuomo to receive Emmy award for his 'leadership' during the pandemic, Twitter goes nuts	0.24	0	0	O
t3_jybwzd	politics	There are so many ways we could have done better	0.98	148	0	O
t3_jybr0t	politics	Majority of voters now feel hopeful about the state of the U.S., poll says	0.97	1278	0	O
t3_jybpms	politics	Voters support more police oversight in cities across U.S., including in California	0.98	557	0	O
t3_jybneh	politics	Oligarch of the Month: Kelly Loeffler	0.99	4167	0	O
t3_jybmr4	politics	Mnuchin’s Inglorious Endgame	0.94	116	0	O
t3_jyblw0	politics	Former Facebook leaders are now transition insiders	0.73	22	0	O
t3_jybiph	politics	Arizona turnout proves power of Native vote	0.99	2583	0	O
t3_jybfn6	politics	More Republicans Distrust This Year’s Election Results Than Democrats After 2016	0.93	268	0	O
t3_jyb4kl	politics	America is Buckling	0.72	41	0	O
t3_jyb13e	politics	Georgia Governor calls for Audit after state certifies result	0.92	233	0	O
t3_jyb06y	politics	In cities nationwide, voters sanction more police oversight	0.99	415	0	O
t3_jyaldu	politics	Justices put off case over access to Russia probe grand jury	0.87	38	0	O
t3_jyaguq	politics	1 America, 1 Pandemic, 2 Realities	0.98	84	0	O
t3_jyac3z	politics	Judge tosses last election lawsuit in Arizona	0.98	17519	0	O
t3_jyabs2	politics	The Founders didn’t prepare for a president who refuses to step down, historians say	0.98	4700	0	O
t3_jyabpe	politics	'Looks Like the Crazy Lady Has Logged On': Rep. Ilhan Omar Welcomes QAnon Conspiracy Theorist Marjorie Taylor Greene to Congress	0.98	4797	0	O
t3_jya80e	politics	Failed GOP candidate who denounced Pete Buttigieg’s “homo-ocracy” gets COVID after claiming immunity	0.95	30042	0	O
t3_jya4fz	politics	US Congress members demand halt to deportations of women who accused gynecologist of abuse	0.99	2260	0	O
t3_jy9y61	politics	Pompeo's strange farewell tour, full of symbolism and silence	0.88	54	0	O
t3_jy9x30	politics	Mike Pompeo to meet Taliban negotiators in Qatar | Asia	0.84	41	0	O
t3_jy9mmm	politics	"GOP Senators Get Stark Reminder Of Their Previous ""Let The Voters Decide"" Demands"	0.99	9598	0	O
t3_jy9503	politics	Kelly Loeffler marketed derivatives during Great Recession at world's most notorious tax haven	0.99	6840	0	O
t3_jy8wkh	politics	CIA Awards Secret Multibillion-Dollar Cloud Contract	0.89	50	0	O
t3_jy8qem	politics	Progressive initiatives popular even in red states	0.98	304	0	O
t3_jy8mqk	politics	Fact check: Claims linking Dominion Voting Systems to Democrats are wrong or misleading	0.98	633	0	O
t3_jy89rn	politics	Facts don't support GOP Chair Carnahan's election claims	0.88	58	0	O
t3_jy858r	politics	The Class War at Walmart	0.65	25	0	O
t3_jy7va3	politics	Pence Expresses Confidence While Coronavirus Surges	0.72	32	0	O
t3_jy79zd	politics	Despite court challenge , Wisconsin governor renews mask mandate	0.97	160	0	O
t3_jy706r	politics	Georgia Sen. David Perdue declines to debate opponent ahead of January 5 runoff	0.98	1137	0	O
t3_jy6sz1	politics	Gavin Newsom, Andrew Cuomo and the perils of pandemic stardom	0.27	0	0	O
t3_jy6qtt	politics	Tibetan political leader visits White House for first time in six decades	0.65	17	0	O
t3_jy6dhj	politics	Apple is lobbying against a bill aimed at stopping forced labor in China	0.94	386	0	O
t3_jy6ave	politics	GOP lawyers confuse Minnesota with Michigan in Georgia case they lost	0.96	176	0	O
t3_jy684m	politics	Rudy Giuliani Is a Hot Mess	0.96	256	0	O
t3_jy62c4	politics	Tennessee bill would expand coronavirus vaccine exemptions	0.9	49	0	O
t3_jy5l8k	politics	Mnuchin insists US has $800bn 'bazooka' after clawing back funds	0.75	35	0	O
t3_jy5kwo	politics	Mitch McConnell says Congress should redirect unspent stimulus money to prop up small businesses, backing Mnuchin in his fight against the Fed	0.74	44	0	O
t3_jy50uq	politics	California NAACP leader to step down amid conflict-of-interest criticism	0.81	36	0	O
t3_jy4uyq	politics	Ben Carson says he's 'out of the woods' after being 'extremely sick' with COVID-19	0.83	97	0	O
t3_jy4qpz	politics	They're All in on This, Top to Bottom	0.99	213	0	O
t3_jy4iv3	politics	Florida Bans on Conversion Therapy for Children Voided by U.S. Appeals Court	0.95	284	0	O
t3_jy49he	politics	Court: Tennessee can enforce Down syndrome abortion ban	0.91	131	0	O
t3_jy41i7	politics	AOC calls out Mitch McConnell for Senate's Thanksgiving break without stimulus deal	0.92	37678	0	O
t3_jy41cj	politics	White House Urges Vigilance On Coronavirus But Rejects Lockdowns As Solution	0.85	52	0	O
t3_jy3zq2	politics	Maricopa County Board of Supervisors vote unanimously to certify election results	0.99	2420	0	O
t3_jy3ycf	politics	This Republican governor's explanation for why he won't issue a mask mandate is, uh, something else	0.96	197	0	O
t3_jy3pu9	politics	Maryland officials renew Hogan criticism on 500K virus tests	0.84	50	0	O
t3_jy3mmz	politics	Mondaire Jones, One of 1st Black Gay Congressmen, Is Voted Freshman Leader	0.97	279	0	O
t3_jy3jkq	politics	U.S. Army Didn't Seize Election Servers in Germany	0.97	513	0	O
t3_jy3evh	politics	Ben Carson Says He Was 'Desperately Ill' With The Coronavirus	0.93	130	0	O
t3_jyii2e	conservatives	Hey y’all I started a subreddit called What If I were in charge. It’s a place you could post your ideas of what a better society would look like.	1.0	1	0	O
t3_jye817	conservatives	Just Imagine	0.83	14	0	O
t3_jyfq80	conservatives	Steven Crowder says this is why more than 150-thousand Michigan votes could be suspect	0.77	7	0	O
t3_jygyt5	conservatives	White House Unveils Distribution Plan For Operation Warp Speed Vaccines	0.76	2	0	O
t3_jygbkk	conservatives	Hard-to-find 2020 election fraud stories and links	0.4	0	0	O
t3_jyfd6g	conservatives	Awaiting the Kraken	1.0	4	0	O
t3_jyf5ww	conservatives	7 Ways the 2005 Carter-Baker Report Could Have Averted Problems With 2020 Election (And Dems Oppose Them All)	0.85	9	0	O
t3_jycyha	conservatives	Of course someone at CNN would sympathize with a child rapist and a murderer.....	0.73	12	0	O
t3_jya5hf	conservatives	Scott Baio tells Sen. Romney he may move to Utah and unseat him	0.95	17	0	O
t3_jy9msw	conservatives	Kyle Rittenhouse freed on $2 million bail	0.6	9	0	O
t3_jy9drh	conservatives	Whats your opinion?	0.94	1091	0	O
t3_jy9mb9	conservatives	A Two Tiered and Categorical Approach to the Nondelegation Doctrine	1.0	1	0	O
t3_jy9ly7	conservatives	Gavin Newsom: His Gruesome Record	0.78	5	0	O
t3_jy9fi9	conservatives	Insulting to many families this Thanksgiving	0.5	0	0	O
t3_jy9f0t	conservatives	Boss	0.6	1	0	O
t3_jy9etm	conservatives	Classy	0.6	1	0	O
t3_jy6voh	conservatives	Ezra Klein To Depart Vox Media	0.75	2	0	O
t3_jy46a9	conservatives	Sidney Powell's recent interview with Howie Carr...rather DISTURBING news if there is evidence. You should listen.	0.5	0	0	O
t3_jy0ge0	conservatives	Sidney Powell Claims That Dominion Is 'Shredding Documents'	0.87	82	0	O
t3_jy0009	conservatives	Members of the White House Coronavirus Task Force Hold a Press Briefing 11/19/20	0.6	2	0	O
t3_jxyt8s	conservatives	Cuomo to get Emmy for use of TV during COVID-19 pandemic	0.45	0	0	O
t3_jxxskh	conservatives	WTF!	0.3	0	0	O
t3_jxxubs	conservatives	Ben Knew.....	0.92	456	0	O
t3_jxvecu	conservatives	'We Must Cancel Thanksgiving,' Says CDC Scientist Who Looks Suspiciously Like A Turkey In A Lab Coat	0.75	14	0	O
t3_jxvb7c	conservatives	Dominion Voting Systems Reassures the Public That the Election Was Fair and Legal By... Abruptly Backing Out of a Pennsylvania State House Hearing and Lawyering Up	0.91	63	0	O
t3_jxurxt	conservatives	Venezuelan bishop: Isn’t anyone concerned that Iran’s building a “strategic” military base here?	1.0	18	0	O
t3_jxtt0r	conservatives	DeKalb County elections manager fired for errors found in ballot audit	0.91	16	0	O
t3_jxtiar	conservatives	Leftist BuzzFeed Slated to Buy Verizon Media’s Liberal HuffPost	0.56	1	0	O
t3_jxt7o5	conservatives	Democrats mad that someone without a platform or face took crucial votes from them	0.83	30	0	O
t3_jxt6or	conservatives	Black Female Police Chief in Virginia Fired After Aggressively Investigating and Prosecuting Mob Violence	0.93	112	0	O
t3_jxt5ny	conservatives	'You're a bunch of Socialists': Lindsey Graham torches far-left lawmakers calling on him to resign	0.79	26	0	O
t3_jxt4e1	conservatives	Dominion voting software can permit staff to manually adjust ballot returns during counting process	0.93	62	0	O
t3_jxt3a9	conservatives	Alleged Whitmer kidnapping plotters also planned televised killings of lawmakers, torching capitol - suspects in the plot also expressed on social media a desire to harm some Republicans, including the commander in chief.	0.8	12	0	O
t3_jxt1o8	conservatives	Your Political Leaders Hate You And Think You’re Stupid	0.94	33	0	O
t3_jxt0ha	conservatives	GOP Win In PA: Judge Tosses Thousands Of Ballots Without Dates, Reversing Lower Court Ruling	0.93	601	0	O
t3_jxsz82	conservatives	College deletes Instagram post spotlighting Republican student after fellow students complain conservatives are dangerous, want to kill black people	0.9	32	0	O
t3_jxsysy	conservatives	Kyle Rittenhouse doesn’t regret bringing a gun to Kenosha riots: ‘I would’ve died that night if I didn’t’	0.86	177	0	O
t3_jxrasj	conservatives	Colleges Claim to Promote ‘Critical Thinking,’ but Is That What We Need?	0.46	0	0	O
t3_jxlor6	conservatives	Surprise !	0.64	3	0	O
t3_jxnywc	conservatives	Australian wanting to talk to conservative Americans.	0.7	4	0	O
t3_jxq2p0	conservatives	"""Arizona Governor: Election Is Not Over"""	0.67	6	0	O
t3_jxj4y8	conservatives	Made some calculations you all might find interesting: The real number of votes needed to flip US presidential election results, 2000-2020	0.75	8	0	O
t3_jxj9lq	conservatives	Can't wait to get banned	0.93	384	0	O
t3_jxjws8	conservatives	"""In sworn statement, prominent mathematician flags up to 100,000 Pennsylvania ballots"""	0.86	47	0	O
t3_jxdccc	conservatives	Gavin Newsom's apology (if read by Alex Jones)	0.33	0	0	O
t3_jxgwx2	conservatives	The truth about Kamala Harris	0.5	0	0	O
t3_jxieo9	conservatives	True Suppression playbook	0.5	0	0	O
t3_jxibr3	conservatives	It’s you they’re after...	0.84	508	0	O
t3_jxhyb6	conservatives	Official Sources Say This Cartoon Is False	0.93	37	0	O
t3_jxee2v	conservatives	I'm really confused, did right cheat, or did the left cheat?	0.67	5	0	O
t3_jxbitq	conservatives	Sidney Powell Releases the Voter Fraud Kraken On Media to Their Faces	0.79	30	0	O
t3_jxazdi	conservatives	Rudy Giuliani, Sidney Powell Release The Kraken, Give Specific Bombshell Evidence of Voter Fraud	0.58	4	0	O
t3_jxawn2	conservatives	NYC Mayor Says to Brace for End of Indoor Dining in the Next Week or Two	0.86	10	0	O
t3_jxaor6	conservatives	Election Fallout: The Squad Adds Members To The Democrat Anti-Israel Caucus	0.75	8	0	O
t3_jxanpc	conservatives	Who are you with?	0.74	9	0	O
t3_jxadx2	conservatives	Republican Members of Michigan’s House Introduce Resolution to Impeach Whitmer	0.85	48	0	O
t3_jx9vml	conservatives	Would You Guys Fill Out This Form? It's For a School Project. Thanks!	0.5	0	0	O
t3_jx8zel	conservatives	Never forget, this is who BLM and Liberals look up to 😂😂😂	0.95	487	0	O
t3_jx95wx	conservatives	That was a MOAB.	0.83	36	0	O
t3_jx8k2e	conservatives	Question we should be asking our Politicians: What is weighted race voting and why does our election software contain this feature?	0.77	11	0	O
t3_jx7liu	conservatives	Oldie but definitely true today	0.82	7	0	O
t3_jx7uma	conservatives	Kansas Middle School Ends Operation Christmas Child After Atheist Complaint	0.73	11	0	O
t3_jx7ap1	conservatives	Even a Military-Enforced Quarantine Can’t Stop the Virus, Study Reveals	0.76	13	0	O
t3_jx7fea	conservatives	Hospitalizations in the US are normal for this time of year	0.73	19	0	O
t3_jx7qlz	conservatives	Conservative sources you like?	0.67	3	0	O
t3_jx6xeh	conservatives	Leaked Dominion Training Videos Show How Vulnerable the System Is	0.78	18	0	O
t3_jx6wlt	conservatives	COPE: Paul Krugman Whines GOP Senate Majority Will Be ‘Bad for Business’	0.62	2	0	O
t3_jx5v86	conservatives	Republican Canvassers Rescind Their Votes to Certify Wayne County, Michigan, Results -- Claim they were bullied into changing their original votes, and state authorities had refused to conduct an audit.	0.64	6	0	O
t3_jx5la7	conservatives	Here Is The Evidence	0.77	7	0	O
t3_jx59sc	conservatives	History of the U.S Debt Clock	0.71	3	0	O
t3_jx5avw	conservatives	UNC music department launches initiative to fight racism through blog posts	0.66	2	0	O
t3_jx42g5	conservatives	When is it enough?	0.95	998	0	O
t3_jx46nq	conservatives	World Doctors: COVID virus is a SCAM	0.61	8	0	O
t3_jx3bth	conservatives	Today's dark thought: COVID lockdowns are about crashing the economy to bring the Great Reset	0.88	115	0	O
t3_jx3fym	conservatives	They got caught?	0.5	0	0	O
t3_jx2wi3	conservatives	Wayne County GOP members rescind votes to certify election, claim Dems 'bullied' them	0.82	49	0	O
t3_jx2ph6	conservatives	Interesting Read	0.57	2	0	O
t3_jx1691	conservatives	George Soros Decries Palantir Stake	0.53	1	0	O
t3_jx06gn	conservatives	Wayne County Election Board Republicans Sign Affidavits Saying They Were Coerced Into Certifying the Election	0.89	141	0	O
t3_jx036d	conservatives	House Republicans Demand Congressional Investigation Into the Integrity of the 2020 Election, call for hearings 'immediately'	0.76	14	0	O
t3_jwzuyd	conservatives	Woke Racebending	0.43	0	0	O
t3_jwx9hw	conservatives	Anti lockdown protesters in Germany are being met with water cannons.	0.71	7	0	O
t3_jwx0wp	conservatives	"This WAS and remains the reason that many of us are still saying, ""hmmmmmmmmmm""."	0.87	348	0	O
t3_jwwqrr	conservatives	In dramatic reversal, Wayne County election board Republicans rescind votes certifying results In affidavits, GOP canvass board members claim they were bullied and say there are too many irregularities in Detroit vote to justify accepting election results.	0.74	17	0	O
t3_jwv3zu	conservatives	Just when we thought it was safe to go outside.	0.63	5	0	O
t3_jwuprp	conservatives	Joint CIA-Mossad Op Eliminates Al-Qaeda No. 2 Hiding in Iran	0.73	7	0	O
t3_jwujtp	conservatives	Dark times call for dark humor.	0.95	291	0	O
t3_jwuhxc	conservatives	Four Stages of Marxist Takeover: The Accuracy of Yuri Bezmenov	0.56	2	0	O
t3_jwtzgc	conservatives	"Obama laments ‘conservative media’ weakening ‘old network,’ ‘gatekeepers for what’s acceptable’: ""The importance of mainstream, the old network. Walter Cronkite, Nightly News, New York Times, Washington Post, them being sort of the curators and the gatekeepers for what’s acceptable and what’s not."""	0.75	8	0	O
t3_jwtylr	conservatives	America’s Two Largest Republican States Announce They Will Have No More Lockdowns	0.86	47	0	O
t3_jwty08	conservatives	Ted Cruz: 'Facebook, Twitter and Then Google...Pose the Single Greatest Threat We Have to Free Speech'	0.87	33	0	O
t3_jwtxj9	conservatives	Michigan Democrat Doxxes Children Of Wayne County Election Official	0.65	10	0	O
t3_jwtx6x	conservatives	Pennsylvania is Now Mandating Masks INSIDE Your Home	0.66	7	0	O
t3_jwtwyh	conservatives	CAN’T MAKE THIS UP: Guests at Newsom’s Dinner Identified as Officials from California Medical Association	0.8	24	0	O
t3_jwtvlk	conservatives	Megyn Kelly Is Ditching NYC After School Promotes Reforming ‘White Kids,’ Says Future ‘Killer Cop’ In ‘Every Classroom’	0.72	15	0	O
t3_jwtu0i	conservatives	Candace Owens sues Facebook fact-checkers for defamation: 'Time to fact-check the fact-checkers'	0.83	33	0	O
t3_jwt8ij	conservatives	Tens of Thousands of Pennsylvania Ballots Returned Earlier Than Sent Date Claimed	0.63	8	0	O
t3_jws8o1	conservatives	Follow Kyle Becker on Twitter. He’s got training videos on Dominion Voting systems from the SOURCE.	0.57	2	0	O
t3_jwpdz4	conservatives	Pfizer Rounds Up Covid Vaccine Test	0.63	2	0	O
t3_jwnc62	conservatives	Effectiveness of Adding a Mask Recommendation to Other Public Health Measures to Prevent SARS-CoV-2 Infection in Danish Mask Wearers: A Randomized Controlled Trial: Annals of Internal Medicine: Vol 0, No 0	0.71	3	0	O
t3_jwmy2z	conservatives	Judicial Watch Uncovers Nearly 2 MILLION Extra Names On Voter Rolls In Just Two States	0.87	22	0	O
t3_jwlqet	conservatives	Turn off the TV	0.92	1171	0	O
t3_jwl2h7	conservatives	Unity: Michigan Democrat Doxxes Republican’s Children Before She Reverses Course To Certify County Vote	0.8	15	0	O
t3_jwik62	conservatives	Even the left can’t deny Operation Warp speed has been a tremendous success!	0.71	3	0	O
t3_jwkggz	conservatives	AZ: Maricopa County Knew Sharpies Would Be Rejected And Sent Email Ordering That They ONLY Be Used On Election Day	0.85	39	0	O
t3_jwj1i4	conservatives	Georgia election audit finds 3,039 more uncounted ballots in 2 counties	0.89	38	0	O
t3_jwj0te	conservatives	Americans Voted To End War In Syria. This Bureaucrat Overruled Them	0.79	18	0	O
t3_jwizu6	conservatives	Cuomo to receive pay raise at start of 2021 as lower officials' salaries remain stagnant due to pandemic	0.92	69	0	O
t3_jwiz6g	conservatives	Al Gore Calls for Globalist ‘Great Reset,’ Blames Climate Change for Many COVID-19 Deaths	0.76	11	0	O
t3_jwiyhh	conservatives	Tech Hearing And COVID Show Us Exactly Where Censorship Is Headed - (No questioning climate science.)	0.83	17	0	O
t3_jwixo2	conservatives	Experts Claiming 'No Evidence' Of 2020 Fraud Sounded The Alarm In 2017	0.84	20	0	O
t3_jwiuuj	conservatives	Wayne County Election Officials Flip Decision Not to Certify, Here's Some of the Unhinged Harassment They Faced	0.6	4	0	O
t3_jwitwi	conservatives	Democrat Raphael Warnock: ‘Nobody Can Serve’ America In The Military While Also Serving God	0.42	0	0	O
t3_jwipzk	conservatives	CRAZY: New Scientist Exploits Virus to Push Population Control	0.75	14	0	O
t3_jwimhg	conservatives	Registered Florida Dem arrested for making online threats to kill DeSantis, Rubio and Scott: deputies	0.82	14	0	O
t3_jwa5i6	conservatives	Pair Charged With Voter Fraud Allegedly Submitted THOUSANDS of Fraudulent Applications on Behalf of Homeless People - Breaking911	0.72	12	0	O
