name	subreddit	title	upvote_ratio	ups	downs	coding
t3_jyqdbb	politics	Black Farmers Have Been Robbed of Land. A New Bill Would Give Them a “Quantum Leap” Toward Justice	0.96	444	0	O
t3_jyq0am	politics	Democrats fell into the language trap — again	0.22	0	0	O
t3_jypo15	politics	Kelly Loeffler quarantining after testing positive for the coronavirus, then getting inconclusive result	0.94	170	0	O
t3_jypn7i	politics	GOP Sen. Kelly Loeffler, in Georgia runoff, tests positive for coronavirus; receives 2nd inconclusive test	0.97	477	0	O
t3_jypmgf	politics	Chief Afghan peace envoy says US troops pulling out too soon	0.92	128	0	O
t3_jyp8a0	politics	Loeffler tests positive for COVID-19	0.96	28878	0	O
t3_jyp4s7	politics	Loeffler self-isolates after positive Covid test	0.96	378	0	O
t3_jyovoy	politics	Rudy’s bitter end: A former friend and staffer tracks the mayor’s sad decline	0.97	472	0	O
t3_jyopqr	politics	Senator Kelly Loeffler quarantines following inconclusive COVID-19 tests.	0.95	301	0	O
t3_jz5k49	conservatives	'A huge catastrophe': Democrats grapple with congressional and state election losses	1.0	1	0	O
t3_jz554o	conservatives	“KRAKEN” is a CIA Hacking Program.- WikiLeaks	1.0	8	0	O
t3_jz48v8	conservatives	Alinskyism On Steroids: The Great Election Fraud of 2020 -- Scott Lively sees 'corruption of biblical proportions that God alone can deliver us from'	0.57	1	0	O
t3_jz3up8	conservatives	I Was Cancelled Before Ever Setting Foot on Campus	1.0	3	0	O
t3_jz3dpi	conservatives	'Widespread destruction to businesses' in Portland by violent black bloc vandals	0.75	6	0	O
t3_jz2md6	conservatives	The 1620 Project | NAS	0.87	6	0	O
t3_jz09u8	conservatives	'A huge catastrophe': Democrats grapple with congressional and state election losses	0.84	13	0	O
t3_jyzznq	conservatives	Simplest Source of Voter Fraud Is Baked Into the System: no proof of citizenship required -- “6.4 percent of non-citizens voted illegally in the 2008 election” and “80 percent of non-citizens vote Democrat.”	0.85	39	0	O
t3_jyznnu	conservatives	4 Radical Policies That Could Pass if Democrats Win the Georgia Senate Runoffs	0.67	2	0	O
t3_jyz347	conservatives	"McEnany: We Have To Take Election To The Supreme Court To Expose ""Systemic Voter Fraud"" -- ""Our justice system is where that will play, and that is something that the media cannot get in the way of."""	0.91	56	0	O
t3_jyymwf	conservatives	The S&amp;P 500 will rally 12% through 2021 as investors position for a virus-free economy, Credit Suisse says	0.87	11	0	O
t3_jyyliv	conservatives	Short Circuit: A Roundup of Recent Federal Court Decisions—Federal executions, conversion therapy, and clean fuel.	0.75	4	0	O
t3_jywi7a	conservatives	"Sidney Powell: Case Filed This Week 'Will Be Biblical' -- ""You name the manner of fraud and it occurred in Georgia."""	0.91	326	0	O
t3_jyun1g	conservatives	Andrew Cuomo To Receive International Emmy For 'Masterful' COVID-19 Briefings	0.9	109	0	O
t3_jyqvs0	conservatives	"Student loan ""forgiveness"" retroactively punishes good decisions and retroactively rewards bad decisions."	0.78	34	0	O
t3_jyqys4	conservatives	Sidney Powell Is an American Legal Giant	0.92	77	0	O
t3_jyqr5b	conservatives	"""Jordan Sekulow to Newsmax TV: Pending Georgia Lawsuit 'Shocking'"". He added, to those saying ""put up or shut up, it's coming this week."""	0.9	54	0	O
t3_jyl1tw	conservatives	Is this the smoking gun we're looking for?: Dominion Transferring Vote Ratios between Precincts in PA. - By: Edward Solomon	0.89	132	0	O
t3_jykxr5	conservatives	"""Blackwell: The Greatest Electoral Heist in American History"""	0.76	13	0	O
t3_jyii2e	conservatives	Hey y’all I started a subreddit called What If I were in charge. It’s a place you could post your ideas of what a better society would look like.	0.67	1	0	O
t3_jye817	conservatives	Just Imagine	0.79	80	0	O
t3_jyfq80	conservatives	Steven Crowder says this is why more than 150-thousand Michigan votes could be suspect	0.73	23	0	O
t3_jygyt5	conservatives	White House Unveils Distribution Plan For Operation Warp Speed Vaccines	0.73	6	0	O
t3_jygbkk	conservatives	Hard-to-find 2020 election fraud stories and links	0.67	4	0	O
t3_jyfd6g	conservatives	Awaiting the Kraken	0.47	0	0	O
t3_jyf5ww	conservatives	7 Ways the 2005 Carter-Baker Report Could Have Averted Problems With 2020 Election (And Dems Oppose Them All)	0.83	15	0	O
t3_jycyha	conservatives	Of course someone at CNN would sympathize with a child rapist and a murderer.....	0.72	26	0	O
t3_jya5hf	conservatives	Scott Baio tells Sen. Romney he may move to Utah and unseat him	0.76	15	0	O
t3_jy9msw	conservatives	Kyle Rittenhouse freed on $2 million bail	0.55	6	0	O
t3_jy9drh	conservatives	Whats your opinion?	0.93	1573	0	O
t3_jy9mb9	conservatives	A Two Tiered and Categorical Approach to the Nondelegation Doctrine	0.66	2	0	O
t3_jy9ly7	conservatives	Gavin Newsom: His Gruesome Record	0.72	5	0	O
t3_jy9fi9	conservatives	Insulting to many families this Thanksgiving	0.33	0	0	O
t3_jy9f0t	conservatives	Boss	0.44	0	0	O
t3_jy9etm	conservatives	Classy	0.38	0	0	O
t3_jy6voh	conservatives	Ezra Klein To Depart Vox Media	0.75	2	0	O
t3_jy46a9	conservatives	Sidney Powell's recent interview with Howie Carr...rather DISTURBING news if there is evidence. You should listen.	0.42	0	0	O
t3_jy0ge0	conservatives	Sidney Powell Claims That Dominion Is 'Shredding Documents'	0.85	77	0	O
t3_jy0009	conservatives	Members of the White House Coronavirus Task Force Hold a Press Briefing 11/19/20	0.64	3	0	O
t3_jxyt8s	conservatives	Cuomo to get Emmy for use of TV during COVID-19 pandemic	0.36	0	0	O
t3_jxxskh	conservatives	WTF!	0.31	0	0	O
t3_jxxubs	conservatives	Ben Knew.....	0.91	459	0	O
t3_jxvecu	conservatives	'We Must Cancel Thanksgiving,' Says CDC Scientist Who Looks Suspiciously Like A Turkey In A Lab Coat	0.73	15	0	O
t3_jxvb7c	conservatives	Dominion Voting Systems Reassures the Public That the Election Was Fair and Legal By... Abruptly Backing Out of a Pennsylvania State House Hearing and Lawyering Up	0.88	64	0	O
t3_jxurxt	conservatives	Venezuelan bishop: Isn’t anyone concerned that Iran’s building a “strategic” military base here?	0.99	18	0	O
t3_jxtt0r	conservatives	DeKalb County elections manager fired for errors found in ballot audit	0.82	17	0	O
t3_jxtiar	conservatives	Leftist BuzzFeed Slated to Buy Verizon Media’s Liberal HuffPost	0.56	1	0	O
t3_jxt7o5	conservatives	Democrats mad that someone without a platform or face took crucial votes from them	0.77	27	0	O
t3_jxt6or	conservatives	Black Female Police Chief in Virginia Fired After Aggressively Investigating and Prosecuting Mob Violence	0.92	116	0	O
t3_jxt5ny	conservatives	'You're a bunch of Socialists': Lindsey Graham torches far-left lawmakers calling on him to resign	0.76	26	0	O
t3_jxt4e1	conservatives	Dominion voting software can permit staff to manually adjust ballot returns during counting process	0.9	64	0	O
t3_jxt3a9	conservatives	Alleged Whitmer kidnapping plotters also planned televised killings of lawmakers, torching capitol - suspects in the plot also expressed on social media a desire to harm some Republicans, including the commander in chief.	0.81	15	0	O
t3_jxt1o8	conservatives	Your Political Leaders Hate You And Think You’re Stupid	0.87	32	0	O
t3_jxt0ha	conservatives	GOP Win In PA: Judge Tosses Thousands Of Ballots Without Dates, Reversing Lower Court Ruling	0.92	595	0	O
t3_jxsz82	conservatives	College deletes Instagram post spotlighting Republican student after fellow students complain conservatives are dangerous, want to kill black people	0.82	31	0	O
t3_jxsysy	conservatives	Kyle Rittenhouse doesn’t regret bringing a gun to Kenosha riots: ‘I would’ve died that night if I didn’t’	0.83	170	0	O
t3_jxrasj	conservatives	Colleges Claim to Promote ‘Critical Thinking,’ but Is That What We Need?	0.43	0	0	O
t3_jxlor6	conservatives	Surprise !	0.64	4	0	O
t3_jxnywc	conservatives	Australian wanting to talk to conservative Americans.	0.7	4	0	O
t3_jxq2p0	conservatives	"""Arizona Governor: Election Is Not Over"""	0.65	6	0	O
t3_jxj4y8	conservatives	Made some calculations you all might find interesting: The real number of votes needed to flip US presidential election results, 2000-2020	0.73	7	0	O
t3_jxj9lq	conservatives	Can't wait to get banned	0.93	380	0	O
t3_jxjws8	conservatives	"""In sworn statement, prominent mathematician flags up to 100,000 Pennsylvania ballots"""	0.83	42	0	O
t3_jxdccc	conservatives	Gavin Newsom's apology (if read by Alex Jones)	0.33	0	0	O
t3_jxgwx2	conservatives	The truth about Kamala Harris	0.25	0	0	O
t3_jxieo9	conservatives	True Suppression playbook	0.38	0	0	O
t3_jxibr3	conservatives	It’s you they’re after...	0.83	510	0	O
t3_jxhyb6	conservatives	Official Sources Say This Cartoon Is False	0.89	35	0	O
t3_jxee2v	conservatives	I'm really confused, did right cheat, or did the left cheat?	0.65	5	0	O
t3_jxbitq	conservatives	Sidney Powell Releases the Voter Fraud Kraken On Media to Their Faces	0.78	29	0	O
t3_jxazdi	conservatives	Rudy Giuliani, Sidney Powell Release The Kraken, Give Specific Bombshell Evidence of Voter Fraud	0.59	4	0	O
t3_jxawn2	conservatives	NYC Mayor Says to Brace for End of Indoor Dining in the Next Week or Two	0.86	10	0	O
t3_jxaor6	conservatives	Election Fallout: The Squad Adds Members To The Democrat Anti-Israel Caucus	0.74	7	0	O
t3_jxanpc	conservatives	Who are you with?	0.66	6	0	O
t3_jxadx2	conservatives	Republican Members of Michigan’s House Introduce Resolution to Impeach Whitmer	0.85	47	0	O
t3_jx9vml	conservatives	Would You Guys Fill Out This Form? It's For a School Project. Thanks!	0.5	0	0	O
t3_jx8zel	conservatives	Never forget, this is who BLM and Liberals look up to 😂😂😂	0.95	485	0	O
t3_jx95wx	conservatives	That was a MOAB.	0.86	37	0	O
t3_jx8k2e	conservatives	Question we should be asking our Politicians: What is weighted race voting and why does our election software contain this feature?	0.74	9	0	O
t3_jx7liu	conservatives	Oldie but definitely true today	0.64	3	0	O
t3_jx7uma	conservatives	Kansas Middle School Ends Operation Christmas Child After Atheist Complaint	0.72	10	0	O
t3_jx7ap1	conservatives	Even a Military-Enforced Quarantine Can’t Stop the Virus, Study Reveals	0.79	14	0	O
t3_jx7fea	conservatives	Hospitalizations in the US are normal for this time of year	0.73	18	0	O
t3_jx7qlz	conservatives	Conservative sources you like?	0.67	3	0	O
t3_jx6xeh	conservatives	Leaked Dominion Training Videos Show How Vulnerable the System Is	0.78	18	0	O
t3_jx6wlt	conservatives	COPE: Paul Krugman Whines GOP Senate Majority Will Be ‘Bad for Business’	0.62	2	0	O
t3_jx5v86	conservatives	Republican Canvassers Rescind Their Votes to Certify Wayne County, Michigan, Results -- Claim they were bullied into changing their original votes, and state authorities had refused to conduct an audit.	0.67	7	0	O
t3_jx5la7	conservatives	Here Is The Evidence	0.75	8	0	O
t3_jx59sc	conservatives	History of the U.S Debt Clock	0.71	3	0	O
t3_jx5avw	conservatives	UNC music department launches initiative to fight racism through blog posts	0.62	2	0	O
t3_jx42g5	conservatives	When is it enough?	0.95	1000	0	O
t3_jx46nq	conservatives	World Doctors: COVID virus is a SCAM	0.6	8	0	O
t3_jx3bth	conservatives	Today's dark thought: COVID lockdowns are about crashing the economy to bring the Great Reset	0.88	113	0	O
t3_jx3fym	conservatives	They got caught?	0.5	0	0	O
t3_jx2wi3	conservatives	Wayne County GOP members rescind votes to certify election, claim Dems 'bullied' them	0.81	47	0	O
t3_jx2ph6	conservatives	Interesting Read	0.6	3	0	O
t3_jx1691	conservatives	George Soros Decries Palantir Stake	0.5	0	0	O
t3_jx06gn	conservatives	Wayne County Election Board Republicans Sign Affidavits Saying They Were Coerced Into Certifying the Election	0.89	141	0	O
t3_jx036d	conservatives	House Republicans Demand Congressional Investigation Into the Integrity of the 2020 Election, call for hearings 'immediately'	0.75	13	0	O
t3_jwzuyd	conservatives	Woke Racebending	0.44	0	0	O
t3_jwx9hw	conservatives	Anti lockdown protesters in Germany are being met with water cannons.	0.76	9	0	O
t3_jwx0wp	conservatives	"This WAS and remains the reason that many of us are still saying, ""hmmmmmmmmmm""."	0.87	348	0	O
t3_jwwqrr	conservatives	In dramatic reversal, Wayne County election board Republicans rescind votes certifying results In affidavits, GOP canvass board members claim they were bullied and say there are too many irregularities in Detroit vote to justify accepting election results.	0.71	15	0	O
t3_jwv3zu	conservatives	Just when we thought it was safe to go outside.	0.67	6	0	O
t3_jwuprp	conservatives	Joint CIA-Mossad Op Eliminates Al-Qaeda No. 2 Hiding in Iran	0.73	7	0	O
t3_jwujtp	conservatives	Dark times call for dark humor.	0.95	292	0	O
t3_jwuhxc	conservatives	Four Stages of Marxist Takeover: The Accuracy of Yuri Bezmenov	0.53	1	0	O
t3_jwtzgc	conservatives	"Obama laments ‘conservative media’ weakening ‘old network,’ ‘gatekeepers for what’s acceptable’: ""The importance of mainstream, the old network. Walter Cronkite, Nightly News, New York Times, Washington Post, them being sort of the curators and the gatekeepers for what’s acceptable and what’s not."""	0.72	8	0	O
t3_jwtylr	conservatives	America’s Two Largest Republican States Announce They Will Have No More Lockdowns	0.87	46	0	O
t3_jwty08	conservatives	Ted Cruz: 'Facebook, Twitter and Then Google...Pose the Single Greatest Threat We Have to Free Speech'	0.83	31	0	O
t3_jwtxj9	conservatives	Michigan Democrat Doxxes Children Of Wayne County Election Official	0.63	8	0	O
t3_jwtx6x	conservatives	Pennsylvania is Now Mandating Masks INSIDE Your Home	0.66	7	0	O
t3_jwtwyh	conservatives	CAN’T MAKE THIS UP: Guests at Newsom’s Dinner Identified as Officials from California Medical Association	0.8	23	0	O
t3_jwtvlk	conservatives	Megyn Kelly Is Ditching NYC After School Promotes Reforming ‘White Kids,’ Says Future ‘Killer Cop’ In ‘Every Classroom’	0.72	15	0	O
t3_jwtu0i	conservatives	Candace Owens sues Facebook fact-checkers for defamation: 'Time to fact-check the fact-checkers'	0.79	29	0	O
t3_jwt8ij	conservatives	Tens of Thousands of Pennsylvania Ballots Returned Earlier Than Sent Date Claimed	0.65	9	0	O
t3_jws8o1	conservatives	Follow Kyle Becker on Twitter. He’s got training videos on Dominion Voting systems from the SOURCE.	0.64	4	0	O
t3_jwpdz4	conservatives	Pfizer Rounds Up Covid Vaccine Test	0.75	4	0	O
t3_jwnc62	conservatives	Effectiveness of Adding a Mask Recommendation to Other Public Health Measures to Prevent SARS-CoV-2 Infection in Danish Mask Wearers: A Randomized Controlled Trial: Annals of Internal Medicine: Vol 0, No 0	0.63	3	0	O
t3_jwmy2z	conservatives	Judicial Watch Uncovers Nearly 2 MILLION Extra Names On Voter Rolls In Just Two States	0.92	23	0	O
t3_jwlqet	conservatives	Turn off the TV	0.92	1172	0	O
t3_jwl2h7	conservatives	Unity: Michigan Democrat Doxxes Republican’s Children Before She Reverses Course To Certify County Vote	0.83	16	0	O
t3_jwik62	conservatives	Even the left can’t deny Operation Warp speed has been a tremendous success!	0.75	4	0	O
t3_jwkggz	conservatives	AZ: Maricopa County Knew Sharpies Would Be Rejected And Sent Email Ordering That They ONLY Be Used On Election Day	0.87	42	0	O
t3_jwj1i4	conservatives	Georgia election audit finds 3,039 more uncounted ballots in 2 counties	0.89	38	0	O
t3_jwj0te	conservatives	Americans Voted To End War In Syria. This Bureaucrat Overruled Them	0.77	16	0	O
t3_jwizu6	conservatives	Cuomo to receive pay raise at start of 2021 as lower officials' salaries remain stagnant due to pandemic	0.93	75	0	O
t3_jwiz6g	conservatives	Al Gore Calls for Globalist ‘Great Reset,’ Blames Climate Change for Many COVID-19 Deaths	0.78	13	0	O
t3_jwiyhh	conservatives	Tech Hearing And COVID Show Us Exactly Where Censorship Is Headed - (No questioning climate science.)	0.78	15	0	O
t3_jwixo2	conservatives	Experts Claiming 'No Evidence' Of 2020 Fraud Sounded The Alarm In 2017	0.82	19	0	O
t3_jwiuuj	conservatives	Wayne County Election Officials Flip Decision Not to Certify, Here's Some of the Unhinged Harassment They Faced	0.63	5	0	O
t3_jwitwi	conservatives	Democrat Raphael Warnock: ‘Nobody Can Serve’ America In The Military While Also Serving God	0.43	0	0	O
t3_jwipzk	conservatives	CRAZY: New Scientist Exploits Virus to Push Population Control	0.73	12	0	O
t3_jwimhg	conservatives	Registered Florida Dem arrested for making online threats to kill DeSantis, Rubio and Scott: deputies	0.82	15	0	O
t3_jwa5i6	conservatives	Pair Charged With Voter Fraud Allegedly Submitted THOUSANDS of Fraudulent Applications on Behalf of Homeless People - Breaking911	0.76	15	0	O
t3_jw9g19	conservatives	Sidney Powell: Here's What a Smartmatic Whistleblower Said About Voter Fraud -- Smartmatic voting system was implemented in Venezuela in 2006 when President Hugo Chavez won and again by Nicolas Maduro in 2013.	0.55	2	0	O
t3_jw6bho	conservatives	Wayne County (Detroit) GOP votes against certifying fraudulent election results. Liberal Tears Incoming	0.48	0	0	O
t3_jw6il2	conservatives	Twitter is ok sometimes.	0.95	494	0	O
t3_jw7oyj	conservatives	Democrats: “PaRLeR Is tHrEaT tO DemOcraCY UsE TwiTtEr!!”	0.91	108	0	O
t3_jw7oxp	conservatives	The GA vote audit is a sham	0.5	0	0	O
t3_jw4blz	conservatives	Cruz shreds Twitter CEO: 'You don’t get to pretend you’re not a publisher'	0.92	177	0	O
t3_jw2rkt	conservatives	Study Finds Connection Between Believing Russia Rigged 2016 Election And Believing 2020 Election Was Foolproof	0.72	21	0	O
t3_jw4c6g	conservatives	“Wayne County Board of canvassers deadlocks 2-2 on certifying the Nov. 3 election.”	0.56	2	0	O
t3_jw46l0	conservatives	Another Georgia county has uncovered 2,700 missing votes, Secretary of State’s office says	0.67	12	0	O
t3_jw2sao	conservatives	All the profits off his book and senior citizens deaths was not enough....	0.65	8	0	O
t3_jw29fo	conservatives	Wisconsin: Disability Service Coordinator Blows Whistle on Vote Fraud in Group Homes	0.75	16	0	O
t3_jw28hg	conservatives	California: 2 Charged with Voter Fraud, Allegedly Submitted Thousands of Registrations on Behalf of Homeless	0.81	29	0	O
t3_jw281h	conservatives	2 Republican candidates file lawsuits seeking new election	0.84	42	0	O
t3_jw1l1f	conservatives	No to a Loan-Debt-Forgiveness/COVID-Relief Compromise	0.59	4	0	O
t3_jw1kvm	conservatives	CA gov't officials: Lockdowns for thee, Hawaii for we?	0.64	7	0	O
t3_jw1ii0	conservatives	Remember when the ACLU defended unpopular speech? What students can learn from ‘Mighty Ira’ documentary	0.59	4	0	O
t3_jw1g26	conservatives	Sublime: Gun Control Support Collapses 10 Points as Relentless Antifa-BLM Violence Continues	0.66	9	0	O
t3_jw0n67	conservatives	2 Charged With Voter Fraud, Allegedly Submitted 8,000 Fraudulent Registration Applications	0.46	0	0	O
t3_jvxv6z	conservatives	Fauci: 'We Must Obey The Government Without Question As The Founding Fathers Intended'	0.5	0	0	O
t3_jvxyvl	conservatives	ABC, NBC Evening Nets Ignore Stock Records After Moderna Vaccine News	0.58	2	0	O
t3_jvxcsx	conservatives	Today, November, 17th, the Czech Republic and Slovak Republic marks the 31st anniversary of the Velvet Revolution and the end of communist government in 1989. Thousands of people are protesting again, in several cities against their dictatorial governments.	0.65	5	0	O
t3_jvwpxq	conservatives	"Smartmatic Director Admitted in 2017 that Their System Was Able to Create ""At Least One Million"" Phantom Votes in that Year's Venezuela Election"	0.71	8	0	O
t3_jvvbe9	conservatives	Republican Michigan state lawmakers launch impeachment pursuit against Whitmer	0.84	47	0	O
t3_jvuafp	conservatives	CISA	0.72	5	0	O
t3_jvudkw	conservatives	Alexandria Ocasio Cortez Doesn't Want to Admit This Problem!	0.42	0	0	O
t3_jvteex	conservatives	The Dominion voting of machines used in 30 states are purpose built to alter elections. Sidney Powell on the Mark Levin show.	0.78	42	0	O
t3_jvpb5z	conservatives	Hypocrisy	0.67	3	0	O
t3_jvr0hu	conservatives	i believe that tax payer money should be used to pay off national debt, change my mind.	0.5	0	0	O
t3_jvspjz	conservatives	'Three Wrong Counts In Three Minutes': Georgia Recount Auditor Says Things Aren't Adding Up	0.92	174	0	O
t3_jvrb51	conservatives	Canada felt the need to say...	0.74	7	0	O
t3_jvjsll	conservatives	To the Lifeboats-Connections being made and Election Bombs being dropped	1.0	2	0	O
t3_jvnst3	conservatives	Democratic Senate Majority	0.7	4	0	O
t3_jvno8w	conservatives	Election Fraud Update for November 16, 2020 Evidence continues to pile up that Democrats stole four states through brazen election fraud in a small number of urban counties. Here’s my attempt to wrangle this fire hose of information into some coherent form:	0.5	0	0	O
t3_jvnho6	conservatives	Clark County Nevada Commission Race Thrown Out Because of 'Discrepancies' in the Vote - Media Right News	0.59	3	0	O
t3_jvmuix	conservatives	Freedom To Fascism In One Virus	0.6	1	0	O
t3_jvm34q	conservatives	Pro-police Republican wins Connecticut House race after 'error' declared Democrat winner	0.91	85	0	O
t3_jvlm8k	conservatives	TFW, you became a karmillionaire and didn't realize until now...you may roast me in comments.	0.67	1	0	O
t3_jvl5w3	conservatives	Rural Georgia County Discovers 2,600 Uncounted Ballots -- But Likely Not Enough to Change Outcome	0.62	4	0	O
t3_jvkq1t	conservatives	Just TRY to cancel granny's Thanksgiving!	0.95	680	0	O
t3_jvipod	conservatives	2018 NY Times Video: Professor Shows Students How Easy It Is to Hack a Dominion Voting Machine	0.72	6	0	O
t3_jvhgkn	conservatives	CNN's Brian Stelter Goes 'Pants on Fire' in Describing Attacks on MAGA Marchers, Gets Dunked Into Next Week	0.8	9	0	O
t3_jvhflt	conservatives	Nearly 3,000 Additional Votes Discovered in Hand Recount in FLoyd County	0.95	187	0	O
t3_jvhe33	conservatives	California School District Bans 'To Kill a Mockingbird,' 'Huckleberry Finn,' Other Classic Novels	0.83	12	0	O
t3_jvha0i	conservatives	French President Macron accuses American media of 'legitimizing' Islamist violence	0.74	12	0	O
t3_jvh0i6	conservatives	The End of Women's Sports	0.91	9	0	O
t3_jvgdqu	conservatives	Michigan House Republicans Plan Gretchen Whitmer Impeachment	0.94	282	0	O
t3_jveauf	conservatives	I have no words. Perfect example of leftist censorship.	0.72	14	0	O
t3_jvdjkg	conservatives	Obama Calls Big Tech ‘Biggest Threat’ to Democracy, Calls for Censorship - Former President Barack Obama condemned Big Tech for allowing conservatives to undermine the liberal establishment and called for social media to be regulated.	0.81	16	0	O
t3_jvbu7g	conservatives	What are your thoughts on Parler?	0.64	3	0	O
t3_jvcz6g	conservatives	Extra! Extra! Read all about it!	0.81	24	0	O
t3_jvcpvo	conservatives	'Except you're FORCED to attend': EPIC thread takes ridiculous 'socialism is just like a potluck, y'all' narrative APART and it's glorious	0.79	12	0	O
t3_jvc1uf	conservatives	So, what do you reckon you'd say to someone who used this chart to justify excusing student loan debt?	0.62	3	0	O
t3_jvbqhx	conservatives	Hi! If you have been here awhile and you are interested in modding, hit us up...(see text).	0.69	7	0	O
t3_jvbo7s	conservatives	"I was told this was a dangerous ""conspiracy theory""...so why is Justin Trudeau talking about the great reset and using Covid as an excuse to ""re-examine economic systems..."""	0.92	80	0	O
t3_jvbghh	conservatives	She has a message for all y'all conservatives... socialism is just like a pot luck!	0.71	3	0	O
t3_jv0gx3	conservatives	Totally real guys	0.5	0	0	O
t3_jvb0uq	conservatives	Obama Defames 'Millions of Americans' as Racists in New Memoir	0.81	23	0	O
t3_jvaxl8	conservatives	Suspect Arrested For Tossing ‘Commercial Grade Firework’ At Restaurant Patrons Following Million MAGA March	0.76	6	0	O
t3_jvavx3	conservatives	UFC fighter Jorge Masvidal says he may start attending conservative rallies 'to keep the peace' after seeing left-wing violence	0.86	21	0	O
t3_jv9gm6	conservatives	The Government Corruption of Science	0.7	11	0	O
t3_jv9eq8	conservatives	3 Ways GOP Must Tackle Vote Fraud And Election Bungling Right Now	0.67	11	0	O
t3_jv98u1	conservatives	Voters Had a Chance to Reject COVID Tyranny, Now a Price Will Be Paid	0.8	28	0	O
t3_jv3utx	conservatives	Corona-chan Brings Communism To Los Angeles	0.77	12	0	O
t3_jv37e1	conservatives	Does Racism Explain Black Disadvantage?	0.64	4	0	O
t3_jv0g99	conservatives	Election maps I made	0.33	0	0	O
t3_juzrjh	conservatives	Rudy Giuliani: 'Dominion Shouldn't Be Counting Votes Anywhere'	0.9	23	0	O
t3_juy6hl	conservatives	Ever notice?	0.82	14	0	O
t3_juvbqy	conservatives	LAWSUIT: GA Sec of State made voter extension deal with Democrats?	0.92	10	0	O
t3_juv3nx	conservatives	Fauci: Masks still required after vaccine | NY Post	0.63	2	0	O
t3_jupcax	conservatives	Dominion Voting Systems Unwrapped - Lets Fix Stuff	0.99	7	0	O
t3_ju57q0	conservatives	The Democratic Party's ideals don't even make logical sense anymore.	1.0	2	0	O
t3_ju9i8m	conservatives	Voting Wrong Turned Me White	0.66	1	0	O
t3_jue7xd	conservatives	Never Forget	0.75	2	0	O
t3_jufkfx	conservatives	BlazeTV Reporter Pulled After Facing Death Threats in DC	0.75	2	0	O
t3_juo27a	conservatives	The political class’s coronavirus credibility crisis endangers public health	0.9	8	0	O
t3_juklrr	conservatives	Short Circuit: A Roundup of Recent Federal Court Decisions	0.67	3	0	O
t3_juklmi	conservatives	Supreme Court to review a Ninth Circuit decision holding that there is no taking when the government forces property owners to grant union organizers temporary access to their property	0.83	4	0	O
t3_juil1j	conservatives	Democrat, North Texas Mayoral Candidate Arrested for Mail-Ballot Voter Fraud, Charged with 109 Felonies	0.95	19	0	O
t3_juikh0	conservatives	The US Raided European Software Company Scytl, seizes servers with links to Dominion Voting System	0.94	15	0	O
