name	subreddit	title	upvote_ratio	ups	downs	coding
t3_jzrxcw	politics	Biden's pick for top spy brings experience from CIA and White House	0.94	38	0	T
t3_jsxsg6	conservatives	Trump looking to build new digital media empire with 'plans to wreck Fox': Report	1	16	0	C
t3_jz0eog	politics	"In Public, Trump Still Claims He Won. In Private, Aides Say He’s Planning for Life After Presidency."	0.99	2225	0	C
t3_jy9uv7	politics	"Trump's Futile Fight To Overturn Election Loss Breeds Turmoil, Risk"	0.93	72	0	AT
t3_jyt5rw	politics	Liz Cheney says Trump should respect ‘sanctity’ of election if he can’t prove claims in court	0.98	2318	0	AT
t3_jz4ivr	politics	Nearly all Pa. counties expect to sign off on election results by Monday despite Trump’s attempts to delay certification	1	232	0	E
t3_jzoyr6	politics	"Trump fears Giuliani, other lawyers in Biden vote challenge are 'fools that are making him look bad'"	0.98	1588	0	AT
t3_jxaek7	conservatives	"It’s obvious now, Fox News CONSPIRED against Trump"	0.8	21	0	C
t3_jvbicl	conservatives	Obama Compares Trump To A Dictator Who Thinks He ‘Can Kill People’ And ‘Suppress Journalists’ In 60 Minutes Interview	0.85	9	0	AT
t3_jysfhm	politics	"Trump campaign requests recount of hand-recounted results in Georgia, which is unlikely to change outcome"	0.96	376	0	E
t3_jzszg1	politics	Michigan certifies Biden victory as Trump’s legal team suffers further losses	0.96	22	0	E
t3_jwiug7	conservatives	"Biden warns: If people don't follow COVID-19 demands for Thanksgiving, 2021 holidays could be more of the same"	0.69	4	0	D
t3_jw10q7	conservatives	Hearing Begins in Trump's Critical Pennsylvania Election Challenge	0.55	3	0	E
t3_jzsruy	politics	"Rush Limbaugh Does Full 180, Blasts Sidney Powell After Team Trump Disavowed Her"	0.93	40	0	C
t3_jwtw0t	conservatives	"Georgia Republican Poll Watcher Discovered Recount Error Off By More Than 9,000 Votes For Biden"	0.86	67	0	E
t3_jzsfqc	politics	First Latino tapped to head DHS signals shift from Trump's hard-line immigration policies	0.9	29	0	D
t3_jy3i78	politics	"Trump’s election legal strategy is all but doomed, but still could damage American democracy, experts say"	0.97	125	0	AT
t3_jzslni	politics	Trump campaign says it will continue legal fight after Michigan certification	0.69	9	0	E
t3_jtmoqe	conservatives	Outlets Push Biden Adviser’s INSANE 4-6 Week Economy Lockdown	1	5	0	AB
t3_jt3zmo	conservatives	BREAKING: Huge Legal Victory for President Trump in Pennsylvania	1	18	0	E
t3_jzrv9z	politics	"Mnuchin to End Key Fed Emergency Programs, Limiting Biden"	0.86	36	0	T
t3_jywgwe	politics	Republican senator congratulates Biden telling Trump to ‘accept outcome of election’	0.99	4753	0	T
t3_jyuup3	politics	Trump Wonders Why Joe Biden Is Forming A Cabinet In Latest Tweet Screed	0.97	12040	0	T
t3_jyh1cz	politics	"McEnany: Trump's path to victory is Supreme Court, exposing 'systemic' voter fraud"	0.12	0	0	E
t3_jvhg0j	conservatives	Pollster: It's Curious How Biden Underperformed Hillary Clinton In Every City...Except These Four.	0.45	0	0	E
t3_jvaw6t	conservatives	Rand Paul Vows to Prevent Biden Lockdown -- 'We Can't Go on Like This Forever'	0.96	181	0	AB
t3_jupguc	conservatives	"In a Blind Test, California Votes for Trump: Ballot Results Show Californians Conservative on Issues"	0.84	8	0	E
t3_jz2pba	politics	Small but growing number of Republicans tell Trump it’s over: “Stop golfing and concede”	0.98	1122	0	AT
t3_jvc5rt	conservatives	Ilhan Omar refers to Trump rallies as Klan rallies.	0.84	9	0	AT
t3_jyiblz	politics	Republican Resistance Looms in the Senate for Biden’s Nominees	0.82	37	0	T
t3_jvnw78	conservatives	Interesting that Facebook and IG have changed Biden from “president-elect” to “projected winner.”	0.54	1	0	C
t3_jyym78	politics	"Biden will announce first Cabinet picks on Tuesday, chief of staff Klain says"	0.95	118	0	T
t3_jzt1lh	politics	GSA tells Biden that transition can formally begin	1	41	0	T
t3_jyj5z6	politics	Detroit voters sue Donald Trump over unsubstantiated claims of voter fraud	0.95	40	0	E
t3_jypw7q	politics	"Out of 53 Republican senators, only two have stood up to Trump's attempt to overturn the election"	0.97	19051	0	C
t3_jzpd2k	politics	Factbox: The Biden Cabinet - President-elect builds his foreign policy team	0.7	12	0	T
t3_jz3wcq	politics	President-elect Joe Biden will announce cabinet picks Tuesday	0.97	108	0	T
t3_jycgfg	politics	"Shame the Random, Unknown Government Officials Aiding Trump’s Coup Attempt"	0.99	4339	0	C
t3_jyrxgl	conservatives	'Very strange': Devin Nunes says Democrats lack confidence in Biden victory	0.9	237	0	C
t3_jzt2tm	politics	GSA tells Biden that transition can formally begin	0.91	19	0	T
t3_jyfthv	politics	Twitter will transfer presidential accounts to Joe Biden on Inauguration Day	0.87	86	0	T
t3_jysdf1	politics	Another defeat for Trump election claims	0.97	155	0	AT
t3_jzp8jd	politics	"Alejandro Mayorkas, Biden's Pick For DHS Head, Would Be First Latino In Post"	0.93	43	0	T
t3_jzrl06	politics	Chris Christie calls Trump's legal team a 'national embarrassment'	0.89	61	0	AT
t3_jyfnzw	conservatives	Hispanic Voters In Florida Who Fled Communist Dictatorships Think The Election Was Stolen From President Trump	0.85	67	0	E
t3_jyxw7j	politics	"Biden inauguration will be ‘scaled down’ because of coronavirus, chief of staff says"	0.99	2903	0	T
t3_jwycmm	conservatives	Tabloid mocked for stinky report about Ivanka Trump: ‘Talk about grasping for straws’	0.72	13	0	C
t3_jytj5f	politics	"Trump or No Trump, Religious Authoritarianism Is Here to Stay"	0.95	1074	0	C
t3_jwgkxc	conservatives	‘Experts’ Listed 27 House Races As Toss-Ups. Republicans Won All 27 - but Trump somehow lost	0.93	385	0	E
t3_jyfwel	politics	Analysis: How Georgia proves Trump has no chance of winning	0.96	155	0	E
t3_jv95ju	conservatives	"Biden's Cancer Charity Took in Millions, Spent Big on Salaries but Nothing on Research"	0.92	253	0	AB
t3_jvavf7	conservatives	Trump laying groundwork for full US troop withdrawal from Afghanistan before leaving office	0.64	3	0	IR
t3_jvb0i5	conservatives	Israel Demands CNN Apology over Amanpour Likening Trump’s Tenure to Nazi Germany	0.82	17	0	IR
t3_jy93rj	politics	"Dear Trump supporters: Those who egg on the president now, given the damage he does to America, are truly reprehensible"	0.98	5833	0	AT
t3_jvnw78	conservatives	Interesting that Facebook and IG have changed Biden from “president-elect” to “projected winner.”	0.53	1	0	C
t3_jz5jzx	politics	Trump campaign says Sidney Powell not a member of legal team	1	11	0	C
t3_jzsmkk	politics	Trump Supporter Who Breathed on Protesters Is Facing Assault Charges	0.96	58	0	AT
t3_jyjecp	politics	Wisconsin officials: Trump observers obstructing recount	1	9	0	E
t3_jy4l6b	politics	What a Biden-Harris Administration Means for U.S. Immigration Policy	0.86	44	0	D
t3_jur09l	conservatives	"Dominion Engineer Told Antifa He'd 'Made Sure' Trump Wouldn't Win, Report Says"	0.94	31	0	C
t3_jtjhk0	conservatives	CNN's Amanpour Likens Trump to Nazis Purging Jews -- 'Assault on Those Same Values'	0.74	5	0	AT
t3_jyrnq8	politics	States and Local Republicans standing up to Trump are putting National GOP leaders to shame	0.99	2253	0	C
t3_jx683s	conservatives	Report: Server Seized In Skytl Raid Shows Trump Actually Got 410 Electoral Votes; Media Panics	0.62	7	0	E
t3_jyiofw	politics	Sen. Graham says Biden should have access to classified intelligence briefings	0.87	60	0	T
t3_jz5a2y	politics	Republicans quietly plot to sink Biden nominees	0.9	29	0	C
t3_jy560y	politics	More U.S. Congress Republicans openly doubt Trump's election claims	0.95	244	0	AT
t3_jzs1zq	politics	How Trump's fundraising could benefit his post-White House political life	0.68	9	0	T
t3_jyu2fl	politics	The federal toll of Trump's failure to lead	0.97	365	0	AT
t3_jyy98l	politics	"Stacey Abrams helped register 800,000 voters and flipped Georgia for Biden. Here's what anyone can learn from her ability to inspire and influence others."	0.87	42652	0	C
t3_jzrave	conservatives	Rep. Nunes Worried Biden Will Shut Down Durham Investigation	0.71	3	0	T
t3_jzqbl0	politics	"Republican Congressman Says GOP 'Embarrassing,' Calls on Party to 'Denounce' Trump's 'Conspiracy Theories'"	0.94	174	0	AT
t3_jzpxxu	politics	Biden taps Blinken to reshape U.S. foreign policy in post-Trump era	0.86	29	0	T
t3_jzsy6s	politics	First on CNN: GSA tells Biden that transition can formally begin	0.98	63	0	T
t3_jyat09	politics	Michigan group sues Trump campaign for alleged mass voter suppression	0.91	60554	0	E
t3_jz3tv7	politics	"Ronna McDaniel has reportedly warned Donald Trump Jr., Kimberly Guilfoyle could succeed her as RNC chair"	0.87	67	0	T
t3_jzpf1h	politics	GM flips to California's side in pollution fight with Trump	0.9	57	0	C
t3_jz265e	politics	"Trump’s legal team cried vote fraud, but courts found none"	0.98	320	0	E
t3_jyskq2	politics	Trump targets Medicare drug prices with cost-cutting measures	0.19	0	0	D
t3_jzrmc0	politics	"Trump’s Ridiculous, Sloppy Coup Attempt Just Face-Planted in Michigan"	0.99	285	0	AT
t3_jwwekr	conservatives	“All Speech Is Not Equal”: Biden Taps Anti-Free Speech Figure For Transition Lead On Media Agency	0.76	7	0	AB
t3_jzoxch	politics	What Donald Trump and Dick Cheney Got Wrong About America	0.88	34	0	C
t3_jzrbs8	politics	Former Fed Chair Janet Yellen reportedly Biden pick for Treasury Secretary	0.83	11	0	T
t3_jzpfqd	politics	Pro-Trump Attorney Urges Republicans Not to Vote in Georgia Runoff	0.82	272	0	E
t3_jwar6u	conservatives	Evidence of Dominion Vote-Flipping Against Bernie Sanders in 2016 Boosts Trump Charges	0.74	9	0	AT
t3_jyamtf	politics	Barack Obama: ‘Donald Trump and I tell very different stories about America’	0.98	3979	0	C
t3_jzr5yp	politics	Michigan Certifies Joe Biden's Election Victory	0.99	243	0	E
t3_jz2pci	politics	Tapper: Judges are running out of pejoratives for Trump's legal efforts - CNN Video	0.95	301	0	AT
t3_jz55kh	politics	"Biden Team, Pushing Quick Stimulus Deal, Prepares for Renewed Recession"	0.92	49	0	T
t3_jz45sv	politics	More key Republicans tell Trump to end delays. ‘Past time to start a transition’	0.98	167	0	T
t3_jsxi7j	conservatives	How Trump Can Win WITHOUT 270 Electoral Votes - The New American	1	6	0	E
t3_jzrr0v	politics	Analysis: Biden's pick for U.N. envoy will find waning American influence	0.83	17	0	T
t3_jxry1p	conservatives	Live: Trump's legal team is holding a press conference about the election	0.44	0	0	E
t3_jycumy	politics	How Members of Anti-Immigrant Extremist Groups Have Worked Closely with — and Joined — the Trump Administration	0.94	113	0	C
t3_jyrxgl	conservatives	'Very strange': Devin Nunes says Democrats lack confidence in Biden victory	0.86	242	0	C
t3_jz1vkv	politics	Immigration activists have renewed hope with Biden's victory	0.82	31	0	T
t3_jyix42	politics	Trump does not participate in G-20 event on global pandemic preparedness	0.97	60	0	IR
t3_jvhg0j	conservatives	Pollster: It's Curious How Biden Underperformed Hillary Clinton In Every City...Except These Four.	0.45	0	0	E
t3_jz2555	politics	"In last-gasp maneuver, Trump campaign tries to invalidate thousands of votes as Wisconsin recount gets underway"	0.97	226	0	AT
t3_jxtace	conservatives	President-elect Biden's tax plan will likely make companies leave the US: NYC billionaire businessman	0.78	45	0	AB
t3_jvax5d	conservatives	"China Expert: Beijing Happy With Biden Win - Chang said “that Twitter took down 174,000 fake Chinese accounts in June alone, which shows you the size of China’s effort. And they were working for Biden even during the Democratic nomination process, because they were favoring him over Bernie Sanders.”"	0.83	12	0	IR
t3_jyhv9o	politics	Trump was pictured on his Virginia golf course during a coronavirus meeting for G20 leaders	0.98	874	0	IR
t3_jyecom	politics	"Rahm Emanuel Reportedly Being Considered for Biden's Cabinet, a Choice That Would Be a Slap in the Face to Black Voters"	0.89	448	0	AB
t3_jtv40i	conservatives	Iran-backed Terrorist Groups in Iraq Cheer Prospect of Biden Presidency	1	2	0	IR
t3_jwtw0t	conservatives	"Georgia Republican Poll Watcher Discovered Recount Error Off By More Than 9,000 Votes For Biden"	0.85	64	0	E
t3_jy5hil	politics	Who needs Russia? Loudest attacks on US vote are from Trump	0.95	233	0	IR
t3_jzn8sy	conservatives	"5 More Ways Joe Biden Magically Outperformed Election Norms -- Surely the journalist class should be intrigued by the historic implausibility of Joe Biden’s victory. That they are not is curious, to say the least."	0.77	21	0	AB
t3_jwk250	conservatives	Beijing Biden Hires Man Who Cost Millions Of American Jobs With China Trade Bill	0.6	2	0	IR
t3_jyhpv7	politics	To Compare Trump to Hitler is to Insult the American People	0.04	0	0	C
t3_jvke6e	conservatives	"Trump asked advisers last week for ‘options’ to attack Iran’s nuclear facilities, says report"	0.61	3	0	IR
t3_jwlfye	conservatives	"Xavier Becerra, possible Biden AG pick, once said illegal immigration should be decriminalized"	0.75	6	0	T
t3_jyy70d	politics	Putin Says He’s Not Ready to Recognize Biden as U.S. President	0.45	0	0	IR
t3_jyxinl	politics	France's Le Drian says he shares Biden's view of Trump's challenge as irresponsible	0.93	82	0	E
t3_jyh1d4	politics	Biden could announce Cabinet picks as soon as next week	0.86	28	0	T
t3_jzsqbv	politics	Secret Service members asked about protecting soon-to-be-former president Trump full time in Florida	0.84	23	0	T
t3_jw2swy	conservatives	"BREAKING: Second Georgia County Finds Thousands More Votes, Majority Are For Trump | The Daily Wire"	0.58	6	0	E
t3_jzq0dh	politics	Biden’s Europe challenge: Repair tattered transatlantic ties | Four years of Donald Trump have done serious damage to mutual trust.	0.89	44	0	IR
t3_jvvi8r	conservatives	Official r/DonaldTrump Election Map	0.46	0	0	E
t3_jzr8px	politics	Michigan certifies Biden win despite Trump's GOP overtures	0.99	607	0	E
t3_jzr77v	politics	"Michigan board votes to certify the state’s election results, dealing Trump another blow"	0.97	282	0	E
t3_jyh4cs	politics	"As world leaders meet to talk pandemic, Trump checks out and hits the links"	0.97	266	0	AT
t3_jxbcgu	conservatives	The Hill’s Joe Concha Takes Blowtorch to Pro-Biden ‘Marshmallow Media’	0.78	7	0	AB
t3_jyht3y	politics	Pompeo’s Grotesque Farewell Party in Israel Shows That the Trump Team Knows It's Over — Pompeo used his visit to Israel and the settlements to push forward his pet ideological project and advance his post-Trump political career.	0.98	127	0	IR
t3_jxbcgu	conservatives	The Hill’s Joe Concha Takes Blowtorch to Pro-Biden ‘Marshmallow Media’	0.89	7	0	AB
t3_jyevov	politics	"Trump Supporters in Georgia Threaten to Destroy GOP, Boycott Runoff Elections"	0.94	34449	0	E
t3_jzoykr	politics	"Trump's on his way out, but leaves a lasting legacy: The right's open embrace of terrorism"	0.95	282	0	AT
t3_jxak6t	conservatives	"Leftists Suggest “Re-education Camps,” “Firing Squads,” Banning Talk Radio to “Deprogram” 75 Million Trump Supporters"	0.76	18	0	AT
t3_jzrlc7	politics	Maine certifies Biden’s victory in the state’s election	0.99	259	0	E
t3_jwweh9	conservatives	Trump Rushes Environmental Regulations That Could Handcuff Biden	0.74	9	0	D
t3_jzrgvq	politics	Biden Team Highlights Cybersecurity Focus With First Cabinet Picks	0.93	31	0	T
t3_jzr5u4	politics	"Biden picks John Kerry as climate czar, Janet Yellen as Treasury secretary"	0.81	13	0	T
t3_jz0vyr	conservatives	Michigan AG Suggests Criminally Charging Republican Legislators for Meeting With Trump	0.83	38	0	D
t3_jyemqz	politics	Donald Trump Will Lose One Of His Twitter Accounts To Joe Biden On Inauguration Day. An account the president uses to retweet his conspiracy theories and vitriol will be wiped and handed over to the Biden administration.	0.96	285	0	T
t3_jzsmiy	politics	Trump Fires Sidney Powell for Election Conspiracies as Though He’s Not About to Claim China Paid Poll Workers to Change All the Ballots to Biden	0.98	48	0	T
t3_jz38b8	politics	"In Wisconsin recount, Trump challenges pile up, slow tally"	0.91	69	0	E
t3_jybo0y	politics	"Yes, Donald Trump claimed fraud after the 2016 Iowa caucuses"	0.98	2176	0	AT
t3_jyar6j	politics	Coronavirus updates: Donald Trump Jr. tests positive; model estimates 471k US deaths by March; Cuomo to receive International Emmy	0.96	309	0	D
t3_jxzwln	conservatives	LEGAL STRATEGY: Multiple Pathways To Victory for Trump | Rudy Giuliani | Ep. 88	0.36	0	0	E
t3_jwijfx	conservatives	National Security Advisor Robert O’Brien delivers remarks on President Trump	0.67	1	0	C
t3_jyjcxb	politics	Wisconsin officials: Trump observers obstructing recount	1	15	0	E
t3_jzpeei	politics	Trump Is Blowing Up the Georgia GOP—and It Couldn’t Happen at a Better Time	0.98	1972	0	AT
t3_jybgkx	politics	Op-Ed: How Biden can restore U.S. global leadership after Trump's retreat from international institutions	0.9	59	0	IR
t3_jynr86	conservatives	Team Trump’s statement on the PA ruling today:	0.64	4	0	E
t3_jyx75d	politics	House Democratic Caucus chairman: Trump's presidency was a 'scam'	0.97	2565	0	AT
t3_jwsoo1	conservatives	"Petition circulating at Harvard to stop former Trump administration officials from attending, teaching or speaking at the university"	0.64	6	0	AT
t3_jyvrie	politics	"Trump's embarrassing, incompetent, humiliating, very sad coup"	0.97	14548	0	AT
t3_jzrdys	politics	Schisms emerging between Far-Right Fox News and soon-to-be former President Donald Trump	0.88	34	0	C
t3_jwijfx	conservatives	National Security Advisor Robert O’Brien delivers remarks on President Trump	0.67	1	0	C
t3_junzxj	conservatives	"Sharyl Attkisson: Media plotted to destroy Trump, cover for Biden"	0.91	17	0	AB
t3_jzpmd7	politics	"Biden Expected to Pick Janet Yellen, Former Fed Chair, as Treasury Secretary"	0.83	38	0	T
t3_jz4z41	politics	"No, You Do Not Have to Feel the Trump Voter's Pain | There is no reason, after five and half years of untruths, dog-whistles, slurs and conspiracies, and weeks of Trump trying to undermine Biden’s win, to hug the people who want to disenfranchise you"	0.94	183	0	AT
t3_jtj502	conservatives	"Pope Congratulates 'Deeply Devout' Catholic Biden, Who Calls Abortion an 'Essential Health Care"	1	1	0	IR
t3_jvc5rt	conservatives	Ilhan Omar refers to Trump rallies as Klan rallies.	0.77	7	0	AT
t3_jxfhko	conservatives	Biden Supporters ASSAULT Elderly Trump Supporters including Women and Children at MAGA March!	0.64	6	0	AB
t3_jzrcjf	politics	"Michigan election board votes to certify Biden win, dealing blow to Trump effort"	0.98	139	0	E
t3_jzrvao	politics	Michigan votes to certify Biden's win over Trump	0.99	93	0	E
t3_jzs5wi	politics	"Michigan board votes to certify the state’s election results, dealing Trump another blow"	0.94	71	0	E
t3_jzrtop	politics	"Bipartisan Michigan election board certifies Biden’s win on 154,000-vote margin"	0.99	76	0	E
t3_jx8wq8	conservatives	"""They Made Significant Mistakes, Like All Crooks Do, and We Caught Them."" Trump's Lawyers Give Updates on the Election Investigation"	0.72	19	0	E
t3_jy6dsk	politics	"Two weeks after Biden named President-elect, Trump faces stinging setbacks"	0.93	121	0	E
t3_jyiyi3	conservatives	Judge rules against Trump global media chief after firings	0.82	7	0	D
t3_jzsznr	politics	GSA tells Biden that transition can formally begin	0.93	24	0	T
t3_jz1bo0	politics	Could Trump Have Been Our First 100 Million-Vote President?	0.03	0	0	E
t3_jvayvj	conservatives	"New Vaccine Developed In Conjunction With Trump’s ‘Operation Warp Speed’ Is 94.5% Effective, Company Says"	0.82	16	0	D
t3_jv9hp5	conservatives	Biden Has a Plan for a New National 'Supply Commander'	0.79	16	0	T
t3_jycwb6	politics	"Meet Pennsylvania’s anger translator, and Donald Trump’s worst nightmare"	0.98	8953	0	AT
t3_jyxi42	politics	Biden transition adviser: Legal action for ascertainment of win 'isn't our preference'	0.96	96	0	T
t3_jyb1xn	conservatives	What you you call it when Hell freezes over only it happened a long time ago and no one knew it that a leftist comedian TOTALLY backed up what Trump is saying now?	0.82	7	0	AB
t3_jyyvlv	politics	"Twitter Recognizes Biden as the Next @POTUS, Despite Trump's Denial"	0.97	774	0	E
t3_jzszq5	politics	"Biden picks John Kerry as climate czar, Janet Yellen as Treasury secretary"	0.86	10	0	T
t3_jywylk	politics	Putin not ready to recognize Biden win	0.52	4	0	IR
t3_jx683s	conservatives	Report: Server Seized In Skytl Raid Shows Trump Actually Got 410 Electoral Votes; Media Panics	0.6	6	0	E
t3_jz32ir	politics	"Larry Hogan to Trump: 'Stop golfing and concede' the election 'If you had done your job, America's governors wouldn't have been forced to fend for themselve,' Hogan said"	0.88	333	0	AT
t3_jzrv19	politics	Georgia sets timeline for Trump-requested recount	0.91	32	0	E
t3_jvvgff	conservatives	Trump’s tweet was removed by Twitter and OP’s account suspended. Peter Neffenger. We are getting closer.	0.96	753	0	AB
t3_jyhdoi	politics	Trump tweets undermine Michigan leaders; images show Chatfield drinking at Trump hotel	0.97	313	0	AT
t3_jyunps	politics	"Trump, laden with $400 million debts, plans to cash in on his post-presidency with a book deal, media appearances, and selling rally tickets, according to a report"	0.95	19421	0	AT
t3_jyagwt	politics	Opinion: About that page of pro-Trump letters...	0.81	32	0	C
t3_jyy5dt	politics	"Facebook, Instagram Will Switch White House Accounts From Trump to Biden on Jan. 20"	0.95	307	0	T
t3_jyfrde	politics	Senator Shirkey and Speaker Chatifeld’s names projected on Trump International Hotel	0.91	71	0	D
t3_jzrq5g	politics	"Michigan election board votes to certify Biden win, dealing blow to Trump effort"	0.98	180	0	E
t3_jz1nzm	politics	National Review Slams Trump’s Refusal To Concede As ‘A Bid For Infamy’ — The conservative magazine condemned the baseless lawsuits and conspiracies of the Trump legal team as a “profoundly undemocratic gambit.”	0.98	997	0	AT
t3_jyx846	politics	Sen. Toomey Congratulates Biden After Pennsylvania Judge Dismisses Trump Lawsuit	0.99	529	0	C
t3_jy4eoa	politics	The GOP's Post-Trump Identity Crisis: What's Next For The Republican Party?	0.86	61	0	C
t3_jx8wq8	conservatives	"""They Made Significant Mistakes, Like All Crooks Do, and We Caught Them."" Trump's Lawyers Give Updates on the Election Investigation"	0.72	18	0	AB
t3_jyudj9	politics	"Actually, it makes perfect sense that Biden would get more votes than Obama"	0.83	52	0	E
t3_jur09l	conservatives	"Dominion Engineer Told Antifa He'd 'Made Sure' Trump Wouldn't Win, Report Says"	0.92	30	0	E
t3_jzrwc2	politics	Pennsylvania Supreme Court Kills Trump Bid to Disqualify Ballots	0.99	322	0	D
t3_jy4gb8	politics	"Biden must listen to Asia, avoid dividing region: Singapore's former US ambassadors"	0.21	0	0	IR
t3_jygs2r	politics	"G20 leaders meet to discuss help for poorest nations in post-Covid world, Trump golfs"	0.99	277	0	IR
t3_jzt5d5	politics	"GSA ascertains Joe Biden is ‘apparent winner’ of election, clears way for the transition from Trump administration to formally begin"	0.96	27	0	E
t3_jzt4q0	politics	GSA tells Biden that transition can formally begin	0.93	24	0	T
t3_jx683s	conservatives	Report: Server Seized In Skytl Raid Shows Trump Actually Got 410 Electoral Votes; Media Panics	0.59	6	0	E
t3_jzsg5c	politics	Biden to pick Janet Yellen for Treasury secretary	0.91	19	0	T
t3_jzruw3	politics	Trump loses yet again as Michigan's state board certifies Biden's win	0.96	68	0	E
t3_jv99mm	conservatives	The Trump Administration Will Produce a Report on Foreign Interference in the Election by December 18	0.93	129	0	AB
t3_jtva01	conservatives	Leftist cabal's sleazy plan to blacklist Trump-supporters blows up in their faces	0.92	10	0	AB
t3_jz227v	politics	"GOP Senator Has Instructed Staff to Cooperate With Biden Transition, Says It's 'Past Time' for Trump to Do Same"	0.99	1759	0	T
t3_jyv7ng	politics	Spy Jonathan Pollard expected to fly to Israel after US lifts parole. Release marks latest gesture by departing Trump administration towards the Israeli government	0.96	241	0	IR
t3_jz003m	politics	Chris Christie calls Trump's legal team a 'national embarrassment'	0.95	209	0	AT
t3_jz2ofa	politics	Miami Republicans won’t criticize baseless Trump claims of Venezuelan election rigging	0.96	193	0	IR
t3_jycft4	politics	The Memo: Trump plows ahead with efforts to overturn election	0.89	60	0	E
t3_jy7val	politics	Joe Biden Doesn’t Need the Senate to Boost the Economy and Tackle Climate Change	0.89	83	0	D
t3_jwycmm	conservatives	Tabloid mocked for stinky report about Ivanka Trump: ‘Talk about grasping for straws’	0.69	11	0	C
t3_jyftsx	politics	"Trump’s Pennsylvania Suit is ‘Incoherent Conspiracy,’ Voters Say"	0.98	686	0	AT
t3_jvizbv	conservatives	Exposed! New Proof On Why I Am CERTAIN Trump Will Win | Janet Porter	0.54	1	0	E
t3_jzrlnt	politics	Michigan certifies Biden win despite Trump's GOP overtures	0.92	47	0	E
t3_jyz8b3	politics	"For U.S. election officials certifying results, Trump's refusal to concede has chilling consequences"	0.97	277	0	E
t3_jzrye4	politics	Michigan votes to certify Biden's win over Trump	0.95	151	0	E
t3_jywf6n	politics	Trump formally requests recount in Georgia	0.9	88	0	E
t3_jzrbwa	politics	"Michigan election board votes to certify Biden win, dealing blow to Trump effort"	0.95	85	0	E
t3_jy79iv	politics	"Trump’s monumental sulk: president retreats from public eye as Covid ravages US | Two weeks after his defeat, Trump has gone from always present to effectively missing, behavior that many say is an unprecedented and dangerous"	0.97	799	0	AT
t3_jvdid1	conservatives	Fareed Zakaria Likens Trump Contesting Election to Pre-Nazi Germany	0.67	3	0	AT
t3_jy8cd3	politics	Geraldo Rivera wants to name the Covid-19 vaccine after Trump	0.27	0	0	D
t3_jyzx05	politics	Latino Democrats tell Mexican president to get with the program and back Biden	0.97	233	0	AT
