name	subreddit	title	upvote_ratio	ups	downs	coding
t3_jx3bth	conservatives	Today's dark thought: COVID lockdowns are about crashing the economy to bring the Great Reset	0.88	117	0	O
t3_jx3fym	conservatives	They got caught?	0.5	0	0	O
t3_jx2wi3	conservatives	Wayne County GOP members rescind votes to certify election, claim Dems 'bullied' them	0.83	50	0	O
t3_jx2ph6	conservatives	Interesting Read	0.57	2	0	O
t3_jx1691	conservatives	George Soros Decries Palantir Stake	0.61	3	0	O
t3_jx06gn	conservatives	Wayne County Election Board Republicans Sign Affidavits Saying They Were Coerced Into Certifying the Election	0.89	143	0	O
t3_jx036d	conservatives	House Republicans Demand Congressional Investigation Into the Integrity of the 2020 Election, call for hearings 'immediately'	0.73	12	0	O
t3_jwzuyd	conservatives	Woke Racebending	0.44	0	0	O
t3_jwx9hw	conservatives	Anti lockdown protesters in Germany are being met with water cannons.	0.79	9	0	O
t3_jwx0wp	conservatives	"This WAS and remains the reason that many of us are still saying, ""hmmmmmmmmmm""."	0.87	352	0	O
t3_jwwqrr	conservatives	In dramatic reversal, Wayne County election board Republicans rescind votes certifying results In affidavits, GOP canvass board members claim they were bullied and say there are too many irregularities in Detroit vote to justify accepting election results.	0.74	17	0	O
t3_jwv3zu	conservatives	Just when we thought it was safe to go outside.	0.7	8	0	O
t3_jwuprp	conservatives	Joint CIA-Mossad Op Eliminates Al-Qaeda No. 2 Hiding in Iran	0.77	7	0	O
t3_jwujtp	conservatives	Dark times call for dark humor.	0.95	290	0	O
t3_jwuhxc	conservatives	Four Stages of Marxist Takeover: The Accuracy of Yuri Bezmenov	0.5	0	0	O
t3_jwtzgc	conservatives	"Obama laments ‘conservative media’ weakening ‘old network,’ ‘gatekeepers for what’s acceptable’: ""The importance of mainstream, the old network. Walter Cronkite, Nightly News, New York Times, Washington Post, them being sort of the curators and the gatekeepers for what’s acceptable and what’s not."""	0.76	9	0	O
t3_jwtylr	conservatives	America’s Two Largest Republican States Announce They Will Have No More Lockdowns	0.88	48	0	O
t3_jwty08	conservatives	Ted Cruz: 'Facebook, Twitter and Then Google...Pose the Single Greatest Threat We Have to Free Speech'	0.84	30	0	O
t3_jwtxj9	conservatives	Michigan Democrat Doxxes Children Of Wayne County Election Official	0.61	7	0	O
t3_jwtx6x	conservatives	Pennsylvania is Now Mandating Masks INSIDE Your Home	0.64	6	0	O
t3_jwtwyh	conservatives	CAN’T MAKE THIS UP: Guests at Newsom’s Dinner Identified as Officials from California Medical Association	0.82	25	0	O
t3_jwtvlk	conservatives	Megyn Kelly Is Ditching NYC After School Promotes Reforming ‘White Kids,’ Says Future ‘Killer Cop’ In ‘Every Classroom’	0.74	16	0	O
t3_jwtu0i	conservatives	Candace Owens sues Facebook fact-checkers for defamation: 'Time to fact-check the fact-checkers'	0.81	31	0	O
t3_jwt8ij	conservatives	Tens of Thousands of Pennsylvania Ballots Returned Earlier Than Sent Date Claimed	0.63	8	0	O
t3_jws8o1	conservatives	Follow Kyle Becker on Twitter. He’s got training videos on Dominion Voting systems from the SOURCE.	0.58	2	0	O
t3_jwpdz4	conservatives	Pfizer Rounds Up Covid Vaccine Test	0.75	4	0	O
t3_jwnc62	conservatives	Effectiveness of Adding a Mask Recommendation to Other Public Health Measures to Prevent SARS-CoV-2 Infection in Danish Mask Wearers: A Randomized Controlled Trial: Annals of Internal Medicine: Vol 0, No 0	0.71	3	0	O
t3_jwmy2z	conservatives	Judicial Watch Uncovers Nearly 2 MILLION Extra Names On Voter Rolls In Just Two States	0.87	22	0	O
t3_jwlqet	conservatives	Turn off the TV	0.92	1168	0	O
t3_jwl2h7	conservatives	Unity: Michigan Democrat Doxxes Republican’s Children Before She Reverses Course To Certify County Vote	0.81	17	0	O
t3_jwik62	conservatives	Even the left can’t deny Operation Warp speed has been a tremendous success!	0.71	3	0	O
t3_jwkggz	conservatives	AZ: Maricopa County Knew Sharpies Would Be Rejected And Sent Email Ordering That They ONLY Be Used On Election Day	0.86	42	0	O
t3_jwj1i4	conservatives	Georgia election audit finds 3,039 more uncounted ballots in 2 counties	0.91	40	0	O
t3_jwj0te	conservatives	Americans Voted To End War In Syria. This Bureaucrat Overruled Them	0.77	17	0	O
t3_jwizu6	conservatives	Cuomo to receive pay raise at start of 2021 as lower officials' salaries remain stagnant due to pandemic	0.93	71	0	O
t3_jwiz6g	conservatives	Al Gore Calls for Globalist ‘Great Reset,’ Blames Climate Change for Many COVID-19 Deaths	0.83	13	0	O
t3_jwiyhh	conservatives	Tech Hearing And COVID Show Us Exactly Where Censorship Is Headed - (No questioning climate science.)	0.82	16	0	O
t3_jwixo2	conservatives	Experts Claiming 'No Evidence' Of 2020 Fraud Sounded The Alarm In 2017	0.81	18	0	O
t3_jwiuuj	conservatives	Wayne County Election Officials Flip Decision Not to Certify, Here's Some of the Unhinged Harassment They Faced	0.61	4	0	O
t3_jwitwi	conservatives	Democrat Raphael Warnock: ‘Nobody Can Serve’ America In The Military While Also Serving God	0.43	0	0	O
t3_jwipzk	conservatives	CRAZY: New Scientist Exploits Virus to Push Population Control	0.73	12	0	O
t3_jwimhg	conservatives	Registered Florida Dem arrested for making online threats to kill DeSantis, Rubio and Scott: deputies	0.79	13	0	O
t3_jwa5i6	conservatives	Pair Charged With Voter Fraud Allegedly Submitted THOUSANDS of Fraudulent Applications on Behalf of Homeless People - Breaking911	0.78	16	0	O
t3_jw9g19	conservatives	Sidney Powell: Here's What a Smartmatic Whistleblower Said About Voter Fraud -- Smartmatic voting system was implemented in Venezuela in 2006 when President Hugo Chavez won and again by Nicolas Maduro in 2013.	0.5	0	0	O
t3_jw6bho	conservatives	Wayne County (Detroit) GOP votes against certifying fraudulent election results. Liberal Tears Incoming	0.52	1	0	O
t3_jw6il2	conservatives	Twitter is ok sometimes.	0.95	497	0	O
t3_jw7oyj	conservatives	Democrats: “PaRLeR Is tHrEaT tO DemOcraCY UsE TwiTtEr!!”	0.91	105	0	O
t3_jw7oxp	conservatives	The GA vote audit is a sham	0.5	0	0	O
t3_jw4blz	conservatives	Cruz shreds Twitter CEO: 'You don’t get to pretend you’re not a publisher'	0.92	173	0	O
t3_jw2rkt	conservatives	Study Finds Connection Between Believing Russia Rigged 2016 Election And Believing 2020 Election Was Foolproof	0.73	22	0	O
t3_jw4c6g	conservatives	“Wayne County Board of canvassers deadlocks 2-2 on certifying the Nov. 3 election.”	0.56	2	0	O
t3_jw46l0	conservatives	Another Georgia county has uncovered 2,700 missing votes, Secretary of State’s office says	0.66	11	0	O
t3_jw2sao	conservatives	All the profits off his book and senior citizens deaths was not enough....	0.65	8	0	O
t3_jw29fo	conservatives	Wisconsin: Disability Service Coordinator Blows Whistle on Vote Fraud in Group Homes	0.75	16	0	O
t3_jw28hg	conservatives	California: 2 Charged with Voter Fraud, Allegedly Submitted Thousands of Registrations on Behalf of Homeless	0.78	25	0	O
t3_jw281h	conservatives	2 Republican candidates file lawsuits seeking new election	0.85	45	0	O
t3_jw1l1f	conservatives	No to a Loan-Debt-Forgiveness/COVID-Relief Compromise	0.62	6	0	O
t3_jw1kvm	conservatives	CA gov't officials: Lockdowns for thee, Hawaii for we?	0.65	7	0	O
t3_jw1ii0	conservatives	Remember when the ACLU defended unpopular speech? What students can learn from ‘Mighty Ira’ documentary	0.61	5	0	O
t3_jw1g26	conservatives	Sublime: Gun Control Support Collapses 10 Points as Relentless Antifa-BLM Violence Continues	0.61	6	0	O
t3_jw0n67	conservatives	2 Charged With Voter Fraud, Allegedly Submitted 8,000 Fraudulent Registration Applications	0.46	0	0	O
t3_jvxv6z	conservatives	Fauci: 'We Must Obey The Government Without Question As The Founding Fathers Intended'	0.53	1	0	O
t3_jvxyvl	conservatives	ABC, NBC Evening Nets Ignore Stock Records After Moderna Vaccine News	0.61	3	0	O
t3_jvxcsx	conservatives	Today, November, 17th, the Czech Republic and Slovak Republic marks the 31st anniversary of the Velvet Revolution and the end of communist government in 1989. Thousands of people are protesting again, in several cities against their dictatorial governments.	0.63	4	0	O
t3_jvwpxq	conservatives	"Smartmatic Director Admitted in 2017 that Their System Was Able to Create ""At Least One Million"" Phantom Votes in that Year's Venezuela Election"	0.66	6	0	O
t3_jvvbe9	conservatives	Republican Michigan state lawmakers launch impeachment pursuit against Whitmer	0.85	51	0	O
t3_jvuafp	conservatives	CISA	0.72	5	0	O
t3_jvudkw	conservatives	Alexandria Ocasio Cortez Doesn't Want to Admit This Problem!	0.36	0	0	O
t3_jvteex	conservatives	The Dominion voting of machines used in 30 states are purpose built to alter elections. Sidney Powell on the Mark Levin show.	0.79	43	0	O
t3_jvpb5z	conservatives	Hypocrisy	0.56	1	0	O
t3_jvr0hu	conservatives	i believe that tax payer money should be used to pay off national debt, change my mind.	0.38	0	0	O
t3_jvspjz	conservatives	'Three Wrong Counts In Three Minutes': Georgia Recount Auditor Says Things Aren't Adding Up	0.92	178	0	O
t3_jvrb51	conservatives	Canada felt the need to say...	0.71	7	0	O
t3_jvjsll	conservatives	To the Lifeboats-Connections being made and Election Bombs being dropped	1.0	2	0	O
t3_jvnst3	conservatives	Democratic Senate Majority	0.7	4	0	O
t3_jvno8w	conservatives	Election Fraud Update for November 16, 2020 Evidence continues to pile up that Democrats stole four states through brazen election fraud in a small number of urban counties. Here’s my attempt to wrangle this fire hose of information into some coherent form:	0.49	0	0	O
t3_jvnho6	conservatives	Clark County Nevada Commission Race Thrown Out Because of 'Discrepancies' in the Vote - Media Right News	0.66	5	0	O
t3_jvmuix	conservatives	Freedom To Fascism In One Virus	0.6	1	0	O
t3_jvm34q	conservatives	Pro-police Republican wins Connecticut House race after 'error' declared Democrat winner	0.91	85	0	O
t3_jvlm8k	conservatives	TFW, you became a karmillionaire and didn't realize until now...you may roast me in comments.	0.67	1	0	O
t3_jvl5w3	conservatives	Rural Georgia County Discovers 2,600 Uncounted Ballots -- But Likely Not Enough to Change Outcome	0.66	6	0	O
t3_jvkq1t	conservatives	Just TRY to cancel granny's Thanksgiving!	0.95	682	0	O
t3_jvipod	conservatives	2018 NY Times Video: Professor Shows Students How Easy It Is to Hack a Dominion Voting Machine	0.67	5	0	O
t3_jvhgkn	conservatives	CNN's Brian Stelter Goes 'Pants on Fire' in Describing Attacks on MAGA Marchers, Gets Dunked Into Next Week	0.71	7	0	O
t3_jvhflt	conservatives	Nearly 3,000 Additional Votes Discovered in Hand Recount in FLoyd County	0.95	183	0	O
t3_jvhe33	conservatives	California School District Bans 'To Kill a Mockingbird,' 'Huckleberry Finn,' Other Classic Novels	0.76	10	0	O
t3_jvha0i	conservatives	French President Macron accuses American media of 'legitimizing' Islamist violence	0.71	11	0	O
t3_jvh0i6	conservatives	The End of Women's Sports	0.84	8	0	O
t3_jvgdqu	conservatives	Michigan House Republicans Plan Gretchen Whitmer Impeachment	0.94	279	0	O
t3_jveauf	conservatives	I have no words. Perfect example of leftist censorship.	0.7	12	0	O
t3_jvdjkg	conservatives	Obama Calls Big Tech ‘Biggest Threat’ to Democracy, Calls for Censorship - Former President Barack Obama condemned Big Tech for allowing conservatives to undermine the liberal establishment and called for social media to be regulated.	0.81	16	0	O
t3_jvbu7g	conservatives	What are your thoughts on Parler?	0.67	3	0	O
t3_jvcz6g	conservatives	Extra! Extra! Read all about it!	0.81	24	0	O
t3_jvcpvo	conservatives	'Except you're FORCED to attend': EPIC thread takes ridiculous 'socialism is just like a potluck, y'all' narrative APART and it's glorious	0.82	11	0	O
t3_jvc1uf	conservatives	So, what do you reckon you'd say to someone who used this chart to justify excusing student loan debt?	0.65	4	0	O
t3_jvbqhx	conservatives	Hi! If you have been here awhile and you are interested in modding, hit us up...(see text).	0.78	10	0	O
t3_jvbo7s	conservatives	"I was told this was a dangerous ""conspiracy theory""...so why is Justin Trudeau talking about the great reset and using Covid as an excuse to ""re-examine economic systems..."""	0.92	78	0	O
t3_jvbghh	conservatives	She has a message for all y'all conservatives... socialism is just like a pot luck!	0.71	3	0	O
t3_jv0gx3	conservatives	Totally real guys	0.5	0	0	O
t3_jvb0uq	conservatives	Obama Defames 'Millions of Americans' as Racists in New Memoir	0.8	21	0	O
t3_jvaxl8	conservatives	Suspect Arrested For Tossing ‘Commercial Grade Firework’ At Restaurant Patrons Following Million MAGA March	0.84	8	0	O
t3_jvavx3	conservatives	UFC fighter Jorge Masvidal says he may start attending conservative rallies 'to keep the peace' after seeing left-wing violence	0.86	21	0	O
t3_jv9gm6	conservatives	The Government Corruption of Science	0.73	12	0	O
t3_jv9eq8	conservatives	3 Ways GOP Must Tackle Vote Fraud And Election Bungling Right Now	0.67	11	0	O
t3_jv98u1	conservatives	Voters Had a Chance to Reject COVID Tyranny, Now a Price Will Be Paid	0.84	29	0	O
t3_jv3utx	conservatives	Corona-chan Brings Communism To Los Angeles	0.84	14	0	O
t3_jv37e1	conservatives	Does Racism Explain Black Disadvantage?	0.64	5	0	O
t3_jv0g99	conservatives	Election maps I made	0.33	0	0	O
t3_juzrjh	conservatives	Rudy Giuliani: 'Dominion Shouldn't Be Counting Votes Anywhere'	0.91	24	0	O
t3_juy6hl	conservatives	Ever notice?	0.82	15	0	O
t3_juvbqy	conservatives	LAWSUIT: GA Sec of State made voter extension deal with Democrats?	0.85	9	0	O
t3_juv3nx	conservatives	Fauci: Masks still required after vaccine | NY Post	0.67	3	0	O
t3_jupcax	conservatives	Dominion Voting Systems Unwrapped - Lets Fix Stuff	0.72	3	0	O
t3_ju57q0	conservatives	The Democratic Party's ideals don't even make logical sense anymore.	1.0	2	0	O
t3_ju9i8m	conservatives	Voting Wrong Turned Me White	0.66	1	0	O
t3_jue7xd	conservatives	Never Forget	0.75	2	0	O
t3_jufkfx	conservatives	BlazeTV Reporter Pulled After Facing Death Threats in DC	0.75	2	0	O
t3_juo27a	conservatives	The political class’s coronavirus credibility crisis endangers public health	0.89	7	0	O
t3_juklrr	conservatives	Short Circuit: A Roundup of Recent Federal Court Decisions	0.86	6	0	O
t3_juklmi	conservatives	Supreme Court to review a Ninth Circuit decision holding that there is no taking when the government forces property owners to grant union organizers temporary access to their property	0.85	5	0	O
t3_juil1j	conservatives	Democrat, North Texas Mayoral Candidate Arrested for Mail-Ballot Voter Fraud, Charged with 109 Felonies	0.91	17	0	O
t3_jyeey7	politics	Biden to work to end executions as government sets 3 more	0.96	73	0	D
t3_jvvgff	conservatives	Trump’s tweet was removed by Twitter and OP’s account suspended. Peter Neffenger. We are getting closer.	0.96	751	0	C
t3_jyvoq1	politics	"Young voters set turnout record, aiding Biden win"	0.99	7362	0	E
t3_jzquzq	politics	"GOP senator: No indication of widespread voting irregularities, window for Trump challenges is 'closing'"	0.95	189	0	E
t3_jv9vi7	conservatives	The Hill’s Joe Concha WRECKS Failed NeverTrump Lincoln Project	0.76	15	0	C
t3_jvdid1	conservatives	Fareed Zakaria Likens Trump Contesting Election to Pre-Nazi Germany	0.83	4	0	AT
t3_jywz3f	politics	How Trump Hopes to Use Party Machinery to Retain Control of the G.O.P.	0.91	96	0	C
t3_jzp4fh	politics	Is Trump Selling Tickets to His 2021 Inauguration?	0.76	33	0	T
t3_jywjti	politics	40% of Top Pentagon Positions Empty After Donald Trump's Firing of Mark Esper	0.98	12076	0	T
t3_jyxocz	politics	Michigan leader: Trump didn’t ask for election interference	0.67	30	0	E
t3_jyqv2m	politics	Why Biden is crowdfunding his White House transition	0.88	93	0	T
t3_junzxj	conservatives	"Sharyl Attkisson: Media plotted to destroy Trump, cover for Biden"	0.95	18	0	AT
t3_jzq7ps	politics	Joe Biden expected to announce Janet Yellen as next treasury secretary pick	0.86	34	0	T
t3_jz3fxh	politics	Claim that Trump 'was never given an orderly transition of power' is false	0.98	622	0	C
t3_jw2swy	conservatives	"BREAKING: Second Georgia County Finds Thousands More Votes, Majority Are For Trump | The Daily Wire"	0.59	7	0	E
t3_jyhkqu	politics	Judge rules against Trump global media chief after firings	0.98	97	0	C
t3_jzrnx5	politics	Michigan certifies Biden victory in another blow to Trump	0.96	121	0	E
t3_jxt0yt	conservatives	Lawyer working on Trump Pennsylvania effort placed under official protection due to threats	0.88	27	0	E
t3_jyb1xn	conservatives	What you you call it when Hell freezes over only it happened a long time ago and no one knew it that a leftist comedian TOTALLY backed up what Trump is saying now?	0.67	7	0	C
t3_jvi9yq	conservatives	Is Biden going to cancel some student loan debt via executive order?	0.85	9	0	D
t3_jyvwlr	politics	Democrats gear up for last oversight showdown with Trump	0.86	45	0	C
t3_jz0elw	politics	President-elect Joe Biden to announce Cabinet picks Tuesday	0.97	185	0	T
t3_jz3r4j	politics	Trump appeals rejection of effort to block Pennsylvania vote	0.91	63	0	E
t3_jyzlna	politics	Biden's 1st Cabinet Picks Expected Tuesday Amid Road Blocks	0.82	37	0	T
t3_jz3bwt	politics	Against Returning to Normal | Joe Biden positioned himself as the “return to normalcy” candidate. But normalcy is not something we can afford—we must actively resist it.	0.87	129	0	D
t3_jzqsc8	politics	"Americans Want Biden to Prioritize Unity Over Progressive Agenda, Survey Finds"	0.23	0	0	D
t3_jyua7c	politics	The shadow of Obama: what influence will the ex-president have on Biden?	0.4	0	0	C
t3_jwp8t0	conservatives	"More Evidence Piles On. Michigan and Georgia, Like in PA and VA, Caught in Same Pattern. Once Biden Gained Lead with MASSIVE Vote Dumps, The Remainder of Votes All Possessed the Same Biden to Trump Vote Ratio – This is Statistically Impossible (details in link)"	0.78	21	0	E
t3_jxfhko	conservatives	Biden Supporters ASSAULT Elderly Trump Supporters including Women and Children at MAGA March!	0.61	5	0	AB
t3_jyxu4b	politics	Biden advisor: 'He does not have any concern' about Trump lawsuits	0.97	339	0	E
t3_jv95ju	conservatives	"Biden's Cancer Charity Took in Millions, Spent Big on Salaries but Nothing on Research"	0.92	257	0	AB
t3_jzorp7	politics	Rush Limbaugh: Trump Needs to Hold Rallies in Georgia	0.05	0	0	C
t3_jt5vid	conservatives	AZ Secretary of State’s History of Disdain for Trump and His Supporters: ‘So Much Deplorable at Trump Rallies’	0.94	12	0	AT
t3_jyiop6	politics	"Trump attacks big Pharma, announces programs to lower drug prices"	0.74	21	0	D
t3_jzt11r	politics	Federal Agency Ascertains Biden ‘Apparent Winner’ of Election: AP	1	15	0	E
t3_jzo9n9	conservatives	Exposed: Sen. GOP Releases Incriminating Evidence in Biden Investigation	0.9	33	0	AB
t3_jvb0i5	conservatives	Israel Demands CNN Apology over Amanpour Likening Trump’s Tenure to Nazi Germany	0.83	16	0	IR
t3_jyc5ef	politics	Trump options narrow as Michigan backs Biden win	0.96	712	0	E
t3_jyebbg	politics	"GOP asks Michigan not to certify election results, citing ‘irregularities’ | The move follows speculation that Trump is seeking to persuade Michigan Republicans to override election results"	0.99	5758	0	E
t3_jzsr22	politics	"Michigan certifies election results, making Biden's win official"	0.96	64	0	E
t3_jvazi4	conservatives	"Obama Compares Trump To Dictator During Interview, Gets Slammed Online For Hypocrisy"	0.71	3	0	AT
t3_jzt28a	politics	GM quits Trump lawsuit against California auto emissions rules	0.87	19	0	C
t3_jzq725	politics	Biden chooses former Fed Chair Janet Yellen to be Treasury secretary	0.76	19	0	T
t3_jzp95d	politics	"Despite Trump’s prod, Mich. to consider certifying Biden win"	0.89	54	0	E
t3_jywklz	conservatives	Philly Bans All Indoor Gatherings Unless You're Still Counting Biden Votes	0.87	311	0	AB
t3_jzq0ke	politics	Biden To Nominate Former Fed Chair Janet Yellen For Treasury Secretary	0.88	35	0	T
t3_jyfk0g	politics	"Sen. Bernie Sanders: ""Thank God"" Joe Biden won the election"	0.97	574	0	E
t3_jyarxl	politics	Neal Katyal: All of Trump’s criminal immunity expires in about 60 days	0.98	8996	0	C
t3_jyy5hi	politics	"Trump, the Saboteur. First a Tantrum, Then Taking Every Opportunity to Trash Our Government"	0.98	1230	0	AT
t3_jygnh6	politics	"Here’s when Biden’s win becomes official — and how Trump is trying to prevent that | With key deadlines looming, derailing the certification of results is part of the president’s strategy"	0.94	74	0	E
t3_jy3jd3	politics	Rudy Giuliani has finally worked out Biden’s evil commie plot with Venezuela and he’s going to right the election	0.94	298	0	IR
t3_jxz4nu	conservatives	Biden to Impose $200 Gun Tax | Americans for Tax Reform	0.7	5	0	D
t3_jxz4nu	conservatives	Biden to Impose $200 Gun Tax | Americans for Tax Reform	0.77	7	0	D
t3_jz1z65	politics	‘Stop golfing and concede’: Trump and Maryland Gov. Hogan spar again after president criticizes South Korean tests	0.99	2480	0	IR
t3_jzrkeu	politics	Michigan Certifies Election Results Showing Biden Victory	0.96	102	0	E
t3_jzt104	politics	Federal Agency Ascertains Biden ‘Apparent Winner’ of Election	1	15	0	E
t3_jzrl9q	politics	Michigan's state board certifies Biden's win	0.98	82	0	E
t3_jwycmm	conservatives	Tabloid mocked for stinky report about Ivanka Trump: ‘Talk about grasping for straws’	0.71	12	0	C
t3_jzt4hq	politics	Biden to pick Janet Yellen for Treasury secretary	0.75	6	0	T
t3_jxaek7	conservatives	"It’s obvious now, Fox News CONSPIRED against Trump"	0.8	20	0	AT
t3_jwlfye	conservatives	"Xavier Becerra, possible Biden AG pick, once said illegal immigration should be decriminalized"	0.67	4	0	AB
t3_jz0az8	politics	Pennsylvania GOP Sen. Toomey Says Trump Should Accept Election Loss	0.96	137	0	E
t3_jyz56l	politics	Trump rails against Paris climate accord in virtual G20 event	0.81	60	0	D
t3_jzi9j6	conservatives	Why is President Trump’s campaign distancing itself from Sidney Powell?	0.75	6	0	C
t3_jwx3zo	conservatives	Georgia Audit Catches Third Batch Of Uncounted Votes Favoring Trump	0.88	81	0	E
t3_jzt2u0	politics	Trump appointee Emily Murphy informs Biden that GSA will begin transition process	0.92	33	0	T
t3_jzsuu3	politics	GSA tells Biden that transition can formally begin	1	426	0	T
t3_jxry1p	conservatives	Live: Trump's legal team is holding a press conference about the election	0.33	0	0	E
t3_jxtace	conservatives	President-elect Biden's tax plan will likely make companies leave the US: NYC billionaire businessman	0.79	43	0	D
t3_jyi4xi	politics	Impeach the president again — Removal from office wouldn’t be the goal this time. It would be to prevent Trump from running again.	0.97	427	0	D
t3_jyd4x9	politics	Joe Biden must understand South Dakotans if he wants a national mask mandate	0.32	0	0	D
t3_jvdid1	conservatives	Fareed Zakaria Likens Trump Contesting Election to Pre-Nazi Germany	0.83	4	0	AT
t3_jye7eu	politics	"In 'Tremendous Rebuke' of Trump Appointee, Federal Judge Bars US Media Agency Head From Interfering in News Coverage | ""Michael Pack has repeatedly and intentionally violated the First Amendment rights of VOA journalists."""	0.99	666	0	C
t3_jyehxb	politics	"No, Venezuelan communists did not interfere in the election. Yes, Trump’s legal team claimed that."	0.99	1975	0	IR
t3_jzssf1	politics	Leaders react after board certifies President-elect Joe Biden’s win in Michigan	0.9	31	0	E
t3_jye9pq	politics	"What to make of more than 70m Americans who voted for Trump? — As of today, 73,781,603 people voted for Trump, which amounts to 47.2 percent of the total votes counted."	0.9	87	0	C
t3_jzra8r	politics	"In blow to Trump, Michigan canvassing board certifies election results"	0.93	57	0	E
t3_jvvq3q	conservatives	UKRAINE HAS NOW LISTED JOE BIDEN AS WANTED ON Class A felony charges.	0.9	873	0	IR
t3_jyzjg9	politics	Congresswoman Liz Cheney is the latest Republican calling on Trump to prove fraud claims in court	0.95	449	0	E
t3_jyft5u	politics	"Tucker Carlson: Forget democratic norms, Democrats want to punish Trump and his supporters"	0.07	0	0	AT
t3_jzqiqp	politics	Biden Choses Alejandro Mayorkas As His Secretary Of Homeland Security	0.91	36	0	T
t3_jz2hjq	politics	Trump team making false argument about his 2016 transition	0.97	120	0	C
t3_jvafi9	conservatives	Trump Set to Expose Efforts of Chinese Government to Penetrate US Government and Public Institutions	0.95	503	0	IR
t3_jzp6x0	politics	"Marjorie Taylor Greene ""solidly convinced"" Trump won Georgia despite state certifying Biden's win"	0.57	11	0	E
t3_jzpko2	politics	Biden to pick ex-Fed chair Yellen for Treasury secretary: WSJ	0.92	59	0	T
t3_jyi1mt	politics	"Trump campaign ""seeking to disenfranchise Black voters"" with election fraud claims: lawsuit"	0.97	82	0	E
t3_jz4v45	politics	"Longtime diplomat says Trump conspiracies hurt U.S. more than Russia, China"	0.98	129	0	IR
t3_jy8vfz	politics	Fareed Zakaria: Trump presidency is stomping on the face of democracy forever	0.98	639	0	AT
t3_jzos3p	politics	It’s Time To Consider Sanctions for Trump’s Legal Team	0.98	3915	0	AT
t3_jycskf	politics	"Paris agreement gets 'new lease on life' under Biden, climate advocates say"	0.98	135	0	D
t3_jyqcfr	politics	"After Pennsylvania court defeat, Trump faces new pressure to concede election"	0.98	9775	0	E
t3_jvafi9	conservatives	Trump Set to Expose Efforts of Chinese Government to Penetrate US Government and Public Institutions	0.95	513	0	IR
t3_jygux6	politics	Analysis | The Pa. county that explains how Biden won big while other Democrats struggled	0.77	26	0	E
t3_jxzypx	conservatives	President Trump Delivers Remarks on Delivering Lower Prescription Drug Prices for All Americans	0.85	33	0	D
t3_jzqioi	politics	Poll: Majority say Trump should concede	0.94	181	0	E
t3_jzow71	conservatives	Do Trump-Supporters Live in an Alternate Universe?- MSNBC'S Nicolle Wallace thinks so. Read the list and decide for yourself.	0.93	12	0	AT
